    1   0.000000  172.30.1.22 → 23.75.212.23 TLSv1.2 207 Application Data
    2   0.255465  172.30.1.22 → 13.113.117.76 TCP 55 [TCP segment of a reassembled PDU]
    3   0.294160 23.75.212.23 → 172.30.1.22  TCP 66 443 → 57263 [ACK] Seq=1 Ack=1 Win=501 Len=0 SLE=4294967148 SRE=1
    4   0.297559 13.113.117.76 → 172.30.1.22  TCP 66 443 → 57211 [ACK] Seq=1 Ack=2 Win=203 Len=0 SLE=1 SRE=2
    5   0.306074 23.75.212.23 → 172.30.1.22  TCP 60 443 → 57263 [ACK] Seq=1 Ack=154 Win=501 Len=0
    6   0.307373 23.75.212.23 → 172.30.1.22  TCP 1514 [TCP segment of a reassembled PDU]
    7   0.307373 23.75.212.23 → 172.30.1.22  TLSv1.2 1251 Application Data
    8   0.307610  172.30.1.22 → 23.75.212.23 TCP 54 57263 → 443 [ACK] Seq=154 Ack=2658 Win=9284 Len=0
    9   0.325482  172.30.1.22 → 23.75.212.23 TLSv1.2 203 Application Data
   10   0.469519 211.115.106.201 → 172.30.1.22  TCP 54 80 → 57282 [FIN, ACK] Seq=1 Ack=1 Win=30 Len=0
   11   0.469519 211.115.106.201 → 172.30.1.22  TCP 54 80 → 57283 [FIN, ACK] Seq=1 Ack=1 Win=30 Len=0
   12   0.469636  172.30.1.22 → 211.115.106.201 TCP 54 57282 → 80 [ACK] Seq=1 Ack=2 Win=511 Len=0
   13   0.469737  172.30.1.22 → 211.115.106.201 TCP 54 57283 → 80 [ACK] Seq=1 Ack=2 Win=511 Len=0
   14   0.632093  172.30.1.22 → 23.75.212.23 TCP 203 [TCP Retransmission] 57263 → 443 [PSH, ACK] Seq=154 Ack=2658 Win=9284 Len=149
   15   0.634989 23.75.212.23 → 172.30.1.22  TCP 60 443 → 57263 [ACK] Seq=2658 Ack=303 Win=501 Len=0
   16   0.634989 23.75.212.23 → 172.30.1.22  TCP 1514 [TCP segment of a reassembled PDU]
   17   0.634989 23.75.212.23 → 172.30.1.22  TLSv1.2 309 Application Data
   18   0.635150  172.30.1.22 → 23.75.212.23 TCP 54 57263 → 443 [ACK] Seq=303 Ack=4373 Win=9284 Len=0
   19   0.646873  172.30.1.22 → 23.75.212.23 TLSv1.2 207 Application Data
   20   0.912339  172.30.1.22 → 18.141.106.53 TCP 55 [TCP segment of a reassembled PDU]
