  361   7.579681  172.30.1.22 → 23.75.212.23 TCP 202 [TCP Retransmission] 57263 → 443 [PSH, ACK] Seq=3315 Ack=49734 Win=9284 Len=148
  362   7.580538 23.75.212.23 → 172.30.1.22  TCP 1514 [TCP segment of a reassembled PDU]
  363   7.581588  172.30.1.22 → 172.217.175.110 UDP 75 54027 → 443 Len=33
  364   7.582871 23.75.212.23 → 172.30.1.22  TCP 1514 443 → 57263 [ACK] Seq=51194 Ack=3463 Win=501 Len=1460 [TCP segment of a reassembled PDU]
  365   7.582871 23.75.212.23 → 172.30.1.22  TCP 1514 443 → 57263 [PSH, ACK] Seq=52654 Ack=3463 Win=501 Len=1460 [TCP segment of a reassembled PDU]
  366   7.582871 23.75.212.23 → 172.30.1.22  TCP 1514 443 → 57263 [ACK] Seq=54114 Ack=3463 Win=501 Len=1460 [TCP segment of a reassembled PDU]
  367   7.582871 23.75.212.23 → 172.30.1.22  TCP 1514 443 → 57263 [ACK] Seq=55574 Ack=3463 Win=501 Len=1460 [TCP segment of a reassembled PDU]
  368   7.583093  172.30.1.22 → 23.75.212.23 TCP 54 57263 → 443 [ACK] Seq=3463 Ack=57034 Win=9284 Len=0
  369   7.586070 23.75.212.23 → 172.30.1.22  TCP 1514 443 → 57263 [PSH, ACK] Seq=57034 Ack=3463 Win=501 Len=1460 [TCP segment of a reassembled PDU]
  370   7.586232  172.30.1.22 → 23.75.212.23 TCP 54 57263 → 443 [ACK] Seq=3463 Ack=58494 Win=9284 Len=0
  371   7.593497 23.75.212.23 → 172.30.1.22  TCP 1514 443 → 57263 [ACK] Seq=58494 Ack=3463 Win=501 Len=1460 [TCP segment of a reassembled PDU]
  372   7.593497 23.75.212.23 → 172.30.1.22  TCP 1514 443 → 57263 [ACK] Seq=59954 Ack=3463 Win=501 Len=1460 [TCP segment of a reassembled PDU]
  373   7.593497 23.75.212.23 → 172.30.1.22  TCP 1514 443 → 57263 [PSH, ACK] Seq=61414 Ack=3463 Win=501 Len=1460 [TCP segment of a reassembled PDU]
  374   7.593497 23.75.212.23 → 172.30.1.22  TCP 1514 443 → 57263 [ACK] Seq=62874 Ack=3463 Win=501 Len=1460 [TCP segment of a reassembled PDU]
  375   7.593497 23.75.212.23 → 172.30.1.22  TCP 1514 443 → 57263 [ACK] Seq=64334 Ack=3463 Win=501 Len=1460 [TCP segment of a reassembled PDU]
  376   7.593497 23.75.212.23 → 172.30.1.22  TLSv1.2 1514 Application Data [TCP segment of a reassembled PDU]
  377   7.593497 23.75.212.23 → 172.30.1.22  TCP 1514 443 → 57263 [ACK] Seq=67254 Ack=3463 Win=501 Len=1460 [TCP segment of a reassembled PDU]
  378   7.593497 23.75.212.23 → 172.30.1.22  TCP 1514 443 → 57263 [ACK] Seq=68714 Ack=3463 Win=501 Len=1460 [TCP segment of a reassembled PDU]
  379   7.593497 23.75.212.23 → 172.30.1.22  TCP 1514 443 → 57263 [PSH, ACK] Seq=70174 Ack=3463 Win=501 Len=1460 [TCP segment of a reassembled PDU]
  380   7.593497 23.75.212.23 → 172.30.1.22  TCP 1514 443 → 57263 [ACK] Seq=71634 Ack=3463 Win=501 Len=1460 [TCP segment of a reassembled PDU]
