   21   0.940185 23.75.212.23 → 172.30.1.22  TCP 66 [TCP Dup ACK 15#1] 443 → 57263 [ACK] Seq=4373 Ack=303 Win=501 Len=0 SLE=154 SRE=303
   22   0.953038 23.75.212.23 → 172.30.1.22  TCP 60 443 → 57263 [ACK] Seq=4373 Ack=456 Win=501 Len=0
   23   0.953776 23.75.212.23 → 172.30.1.22  TCP 1514 [TCP segment of a reassembled PDU]
   24   0.954057 23.75.212.23 → 172.30.1.22  TLSv1.2 1233 Application Data
   25   0.954252  172.30.1.22 → 23.75.212.23 TCP 54 57263 → 443 [ACK] Seq=456 Ack=7012 Win=9284 Len=0
   26   0.983208  172.30.1.22 → 23.75.212.23 TLSv1.2 206 Application Data
   27   1.021179 18.141.106.53 → 172.30.1.22  TCP 66 443 → 57227 [ACK] Seq=1 Ack=2 Win=133 Len=0 SLE=1 SRE=2
   28   1.067451 104.75.25.252 → 172.30.1.22  TLSv1.2 78 Application Data
   29   1.067451 104.75.25.252 → 172.30.1.22  TCP 54 443 → 57249 [FIN, ACK] Seq=25 Ack=1 Win=501 Len=0
   30   1.067677  172.30.1.22 → 104.75.25.252 TCP 54 57249 → 443 [ACK] Seq=1 Ack=26 Win=508 Len=0
   31   1.068104  172.30.1.22 → 104.75.25.252 TCP 54 57249 → 443 [FIN, ACK] Seq=1 Ack=26 Win=508 Len=0
   32   1.288196  172.30.1.22 → 23.75.212.23 TCP 206 [TCP Retransmission] 57263 → 443 [PSH, ACK] Seq=456 Ack=7012 Win=9284 Len=152
   33   1.291842 23.75.212.23 → 172.30.1.22  TCP 60 443 → 57263 [ACK] Seq=7012 Ack=608 Win=501 Len=0
   34   1.291842 23.75.212.23 → 172.30.1.22  TCP 1514 [TCP segment of a reassembled PDU]
   35   1.293216 23.75.212.23 → 172.30.1.22  TLSv1.2 1363 Application Data
   36   1.293373  172.30.1.22 → 23.75.212.23 TCP 54 57263 → 443 [ACK] Seq=608 Ack=9781 Win=9284 Len=0
   37   1.336591  172.30.1.22 → 23.75.212.23 TLSv1.2 202 Application Data
   38   1.381924  172.30.1.22 → 104.75.25.252 TCP 54 [TCP Retransmission] 57249 → 443 [FIN, ACK] Seq=1 Ack=26 Win=508 Len=0
   39   1.388358 173.223.96.137 → 172.30.1.22  TLSv1.2 85 Encrypted Alert
   40   1.388530 173.223.96.137 → 172.30.1.22  TCP 54 443 → 57250 [FIN, ACK] Seq=32 Ack=1 Win=501 Len=0
