  381   7.593497 23.75.212.23 → 172.30.1.22  TCP 1514 443 → 57263 [ACK] Seq=73094 Ack=3463 Win=501 Len=1460 [TCP segment of a reassembled PDU]
  382   7.593497 23.75.212.23 → 172.30.1.22  TLSv1.2 1514 Application Data [TCP segment of a reassembled PDU]
  383   7.593497 23.75.212.23 → 172.30.1.22  TCP 1514 443 → 57263 [ACK] Seq=76014 Ack=3463 Win=501 Len=1460 [TCP segment of a reassembled PDU]
  384   7.593497 23.75.212.23 → 172.30.1.22  TCP 1514 443 → 57263 [ACK] Seq=77474 Ack=3463 Win=501 Len=1460 [TCP segment of a reassembled PDU]
  385   7.593497 23.75.212.23 → 172.30.1.22  TCP 1514 443 → 57263 [PSH, ACK] Seq=78934 Ack=3463 Win=501 Len=1460 [TCP segment of a reassembled PDU]
  386   7.593497 23.75.212.23 → 172.30.1.22  TCP 1514 443 → 57263 [ACK] Seq=80394 Ack=3463 Win=501 Len=1460 [TCP segment of a reassembled PDU]
  387   7.593497 23.75.212.23 → 172.30.1.22  TCP 1514 443 → 57263 [ACK] Seq=81854 Ack=3463 Win=501 Len=1460 [TCP segment of a reassembled PDU]
  388   7.593497 23.75.212.23 → 172.30.1.22  TCP 1514 443 → 57263 [PSH, ACK] Seq=83314 Ack=3463 Win=501 Len=1460 [TCP segment of a reassembled PDU]
  389   7.593497 23.75.212.23 → 172.30.1.22  TCP 1514 443 → 57263 [ACK] Seq=84774 Ack=3463 Win=501 Len=1460 [TCP segment of a reassembled PDU]
  390   7.593497 23.75.212.23 → 172.30.1.22  TCP 1514 443 → 57263 [ACK] Seq=86234 Ack=3463 Win=501 Len=1460 [TCP segment of a reassembled PDU]
  391   7.593497 23.75.212.23 → 172.30.1.22  TCP 1514 443 → 57263 [PSH, ACK] Seq=87694 Ack=3463 Win=501 Len=1460 [TCP segment of a reassembled PDU]
  392   7.593497 23.75.212.23 → 172.30.1.22  TCP 1514 443 → 57263 [ACK] Seq=89154 Ack=3463 Win=501 Len=1460 [TCP segment of a reassembled PDU]
  393   7.593848  172.30.1.22 → 23.75.212.23 TCP 54 57263 → 443 [ACK] Seq=3463 Ack=90614 Win=9284 Len=0
  394   7.595263 23.75.212.23 → 172.30.1.22  TLSv1.2 1514 Application Data [TCP segment of a reassembled PDU]
  395   7.595263 23.75.212.23 → 172.30.1.22  TCP 1514 443 → 57263 [PSH, ACK] Seq=92074 Ack=3463 Win=501 Len=1460 [TCP segment of a reassembled PDU]
  396   7.595263 23.75.212.23 → 172.30.1.22  TCP 1514 443 → 57263 [ACK] Seq=93534 Ack=3463 Win=501 Len=1460 [TCP segment of a reassembled PDU]
  397   7.595263 23.75.212.23 → 172.30.1.22  TCP 1514 443 → 57263 [ACK] Seq=94994 Ack=3463 Win=501 Len=1460 [TCP segment of a reassembled PDU]
  398   7.595263 23.75.212.23 → 172.30.1.22  TCP 1514 443 → 57263 [PSH, ACK] Seq=96454 Ack=3463 Win=501 Len=1460 [TCP segment of a reassembled PDU]
  399   7.595458  172.30.1.22 → 23.75.212.23 TCP 54 57263 → 443 [ACK] Seq=3463 Ack=97914 Win=9284 Len=0
  400   7.599292 23.75.212.23 → 172.30.1.22  TLSv1.2 1514 Application Data [TCP segment of a reassembled PDU]
