  581   9.653197  172.30.1.22 → 172.217.161.66 UDP 1292 60054 → 443 Len=1250
  582   9.653456  172.30.1.22 → 172.217.161.66 UDP 162 60054 → 443 Len=120
  583   9.684915 172.217.161.66 → 172.30.1.22  UDP 68 443 → 60054 Len=26
  584   9.684915 172.217.161.66 → 172.30.1.22  UDP 69 443 → 60054 Len=27
  585   9.693279  172.30.1.22 → 172.217.161.66 UDP 75 60054 → 443 Len=33
  586   9.777352  172.30.1.22 → 18.246.31.133 TLSv1.2 121 Application Data
  587   9.777555  172.30.1.22 → 18.246.31.133 TLSv1.2 93 Application Data
  588   9.788130  172.30.1.22 → 142.251.42.166 TCP 54 57182 → 443 [FIN, ACK] Seq=1 Ack=1 Win=508 Len=0
  589   9.788465  172.30.1.22 → 144.217.66.206 TCP 54 57204 → 443 [FIN, ACK] Seq=1 Ack=33 Win=512 Len=0
  590   9.788736  172.30.1.22 → 209.191.163.210 TCP 54 57280 → 443 [FIN, ACK] Seq=1 Ack=26 Win=513 Len=0
  591   9.788898  172.30.1.22 → 209.191.163.210 TCP 54 57280 → 443 [RST, ACK] Seq=2 Ack=26 Win=0 Len=0
  592   9.789171  172.30.1.22 → 35.213.12.39 TCP 54 57189 → 443 [FIN, ACK] Seq=1 Ack=33 Win=512 Len=0
  593   9.789379  172.30.1.22 → 35.213.12.39 TCP 54 57189 → 443 [RST, ACK] Seq=2 Ack=33 Win=0 Len=0
  594   9.789637  172.30.1.22 → 35.213.120.246 TCP 54 57188 → 443 [FIN, ACK] Seq=1 Ack=33 Win=510 Len=0
  595   9.789765  172.30.1.22 → 35.213.120.246 TCP 54 57188 → 443 [RST, ACK] Seq=2 Ack=33 Win=0 Len=0
  596   9.789991  172.30.1.22 → 35.213.5.5   TCP 54 57186 → 443 [FIN, ACK] Seq=1 Ack=33 Win=513 Len=0
  597   9.790112  172.30.1.22 → 35.213.5.5   TCP 54 57186 → 443 [RST, ACK] Seq=2 Ack=33 Win=0 Len=0
  598   9.790331  172.30.1.22 → 35.213.5.5   TCP 54 57187 → 443 [FIN, ACK] Seq=1 Ack=33 Win=515 Len=0
  599   9.790447  172.30.1.22 → 35.213.5.5   TCP 54 57187 → 443 [RST, ACK] Seq=2 Ack=33 Win=0 Len=0
  600   9.790672  172.30.1.22 → 35.190.60.146 TCP 54 57200 → 443 [FIN, ACK] Seq=1 Ack=1 Win=510 Len=0
