  421   7.605127 23.75.212.23 → 172.30.1.22  TCP 1514 443 → 57263 [ACK] Seq=125654 Ack=3463 Win=501 Len=1460 [TCP segment of a reassembled PDU]
  422   7.605127 23.75.212.23 → 172.30.1.22  TCP 1514 443 → 57263 [PSH, ACK] Seq=127114 Ack=3463 Win=501 Len=1460 [TCP segment of a reassembled PDU]
  423   7.605127 23.75.212.23 → 172.30.1.22  TCP 1514 443 → 57263 [ACK] Seq=128574 Ack=3463 Win=501 Len=1460 [TCP segment of a reassembled PDU]
  424   7.605127 23.75.212.23 → 172.30.1.22  TCP 1514 443 → 57263 [PSH, ACK] Seq=130034 Ack=3463 Win=501 Len=1460 [TCP segment of a reassembled PDU]
  425   7.605127 23.75.212.23 → 172.30.1.22  TCP 1514 443 → 57263 [ACK] Seq=131494 Ack=3463 Win=501 Len=1460 [TCP segment of a reassembled PDU]
  426   7.605127 23.75.212.23 → 172.30.1.22  TCP 1514 443 → 57263 [ACK] Seq=132954 Ack=3463 Win=501 Len=1460 [TCP segment of a reassembled PDU]
  427   7.605127 23.75.212.23 → 172.30.1.22  TCP 1514 443 → 57263 [PSH, ACK] Seq=134414 Ack=3463 Win=501 Len=1460 [TCP segment of a reassembled PDU]
  428   7.605351  172.30.1.22 → 23.75.212.23 TCP 54 57263 → 443 [ACK] Seq=3463 Ack=135874 Win=9284 Len=0
  429   7.606830 23.75.212.23 → 172.30.1.22  TCP 1514 443 → 57263 [ACK] Seq=135874 Ack=3463 Win=501 Len=1460 [TCP segment of a reassembled PDU]
  430   7.606830 23.75.212.23 → 172.30.1.22  TCP 1514 443 → 57263 [ACK] Seq=137334 Ack=3463 Win=501 Len=1460 [TCP segment of a reassembled PDU]
  431   7.606830 23.75.212.23 → 172.30.1.22  TCP 1514 443 → 57263 [PSH, ACK] Seq=138794 Ack=3463 Win=501 Len=1460 [TCP segment of a reassembled PDU]
  432   7.606830 23.75.212.23 → 172.30.1.22  TLSv1.2 1514 Application Data [TCP segment of a reassembled PDU]
  433   7.606830 23.75.212.23 → 172.30.1.22  TCP 1514 443 → 57263 [ACK] Seq=141714 Ack=3463 Win=501 Len=1460 [TCP segment of a reassembled PDU]
  434   7.607005  172.30.1.22 → 23.75.212.23 TCP 54 57263 → 443 [ACK] Seq=3463 Ack=143174 Win=9284 Len=0
  435   7.608645 23.75.212.23 → 172.30.1.22  TCP 1514 443 → 57263 [PSH, ACK] Seq=143174 Ack=3463 Win=501 Len=1460 [TCP segment of a reassembled PDU]
  436   7.608645 23.75.212.23 → 172.30.1.22  TCP 1514 443 → 57263 [ACK] Seq=144634 Ack=3463 Win=501 Len=1460 [TCP segment of a reassembled PDU]
  437   7.608645 23.75.212.23 → 172.30.1.22  TCP 1514 443 → 57263 [ACK] Seq=146094 Ack=3463 Win=501 Len=1460 [TCP segment of a reassembled PDU]
  438   7.608645 23.75.212.23 → 172.30.1.22  TLSv1.2 1514 Application Data [TCP segment of a reassembled PDU]
  439   7.608645 23.75.212.23 → 172.30.1.22  TCP 1514 443 → 57263 [ACK] Seq=149014 Ack=3463 Win=501 Len=1460 [TCP segment of a reassembled PDU]
  440   7.608645 23.75.212.23 → 172.30.1.22  TCP 1514 443 → 57263 [ACK] Seq=150474 Ack=3463 Win=501 Len=1460 [TCP segment of a reassembled PDU]
