  481   8.123610  172.30.1.22 → 35.213.120.246 TCP 54 57188 → 443 [ACK] Seq=1 Ack=33 Win=510 Len=0
  482   8.125480 142.251.42.194 → 172.30.1.22  UDP 73 443 → 51742 Len=31
  483   8.134027  172.30.1.22 → 142.251.42.194 UDP 75 51742 → 443 Len=33
  484   8.175549   35.213.5.5 → 172.30.1.22  TLSv1.2 85 Encrypted Alert
  485   8.175549   35.213.5.5 → 172.30.1.22  TCP 54 443 → 57186 [FIN, ACK] Seq=32 Ack=1 Win=501 Len=0
  486   8.175833  172.30.1.22 → 35.213.5.5   TCP 54 57186 → 443 [ACK] Seq=1 Ack=33 Win=513 Len=0
  487   8.224954   35.213.5.5 → 172.30.1.22  TLSv1.2 85 Encrypted Alert
  488   8.224954   35.213.5.5 → 172.30.1.22  TCP 54 443 → 57187 [FIN, ACK] Seq=32 Ack=1 Win=501 Len=0
  489   8.225200  172.30.1.22 → 35.213.5.5   TCP 54 57187 → 443 [ACK] Seq=1 Ack=33 Win=515 Len=0
  490   8.314138 23.75.212.23 → 172.30.1.22  TCP 60 443 → 57263 [ACK] Seq=164699 Ack=3767 Win=501 Len=0
  491   8.315690 23.75.212.23 → 172.30.1.22  TCP 1514 [TCP segment of a reassembled PDU]
  492   8.315690 23.75.212.23 → 172.30.1.22  TLSv1.2 1033 Application Data
  493   8.315889  172.30.1.22 → 23.75.212.23 TCP 54 57263 → 443 [ACK] Seq=3767 Ack=167138 Win=9284 Len=0
  494   8.332457  172.30.1.22 → 142.251.42.194 UDP 75 51742 → 443 Len=33
  495   8.335332 142.251.42.194 → 172.30.1.22  UDP 207 443 → 51742 Len=165
  496   8.335684 142.251.42.194 → 172.30.1.22  UDP 292 443 → 51742 Len=250
  497   8.335940  172.30.1.22 → 142.251.42.194 UDP 80 51742 → 443 Len=38
  498   8.338660  172.30.1.22 → 23.75.212.23 TLSv1.2 206 Application Data
  499   8.345161  172.30.1.22 → 142.251.42.194 UDP 75 51742 → 443 Len=33
  500   8.368165  172.30.1.22 → 172.217.175.110 UDP 473 54027 → 443 Len=431
