   41   1.388530 104.75.25.252 → 172.30.1.22  TCP 54 443 → 57249 [ACK] Seq=26 Ack=2 Win=501 Len=0
   42   1.388658  172.30.1.22 → 173.223.96.137 TCP 54 57250 → 443 [ACK] Seq=1 Ack=33 Win=513 Len=0
   43   1.388700  172.30.1.22 → 173.223.96.137 TCP 54 57250 → 443 [FIN, ACK] Seq=1 Ack=33 Win=513 Len=0
   44   1.647107  172.30.1.22 → 23.75.212.23 TCP 202 [TCP Retransmission] 57263 → 443 [PSH, ACK] Seq=608 Ack=9781 Win=9284 Len=148
   45   1.650297 23.75.212.23 → 172.30.1.22  TCP 66 [TCP Dup ACK 33#1] 443 → 57263 [ACK] Seq=9781 Ack=608 Win=501 Len=0 SLE=456 SRE=608
   46   1.650297 23.75.212.23 → 172.30.1.22  TCP 60 443 → 57263 [ACK] Seq=9781 Ack=756 Win=501 Len=0
   47   1.650297 23.75.212.23 → 172.30.1.22  TLSv1.2 1403 Application Data
   48   1.662302  172.30.1.22 → 13.225.121.92 TCP 55 [TCP segment of a reassembled PDU]
   49   1.665778  172.30.1.22 → 23.75.212.23 TLSv1.2 203 Application Data
   50   1.669144 13.225.121.92 → 172.30.1.22  TCP 66 443 → 57229 [ACK] Seq=1 Ack=2 Win=133 Len=0 SLE=1 SRE=2
   51   1.692443  172.30.1.22 → 173.223.96.137 TCP 54 [TCP Retransmission] 57250 → 443 [FIN, ACK] Seq=1 Ack=33 Win=513 Len=0
   52   1.903107 173.223.96.137 → 172.30.1.22  TCP 54 443 → 57250 [ACK] Seq=33 Ack=2 Win=501 Len=0
   53   1.954291 23.75.212.23 → 172.30.1.22  TCP 66 [TCP Dup ACK 46#1] 443 → 57263 [ACK] Seq=11130 Ack=756 Win=501 Len=0 SLE=608 SRE=756
   54   1.971202 23.75.212.23 → 172.30.1.22  TCP 60 443 → 57263 [ACK] Seq=11130 Ack=905 Win=501 Len=0
   55   1.971243  172.30.1.22 → 23.75.212.23 TCP 203 [TCP Spurious Retransmission] 57263 → 443 [PSH, ACK] Seq=756 Ack=11130 Win=9279 Len=149
   56   1.972937 23.75.212.23 → 172.30.1.22  TCP 1514 [TCP segment of a reassembled PDU]
   57   1.972937 23.75.212.23 → 172.30.1.22  TLSv1.2 485 Application Data
   58   1.973077  172.30.1.22 → 23.75.212.23 TCP 54 57263 → 443 [ACK] Seq=905 Ack=13021 Win=9284 Len=0
   59   1.986845  172.30.1.22 → 23.75.212.23 TLSv1.2 207 Application Data
   60   2.291483  172.30.1.22 → 23.75.212.23 TCP 207 [TCP Retransmission] 57263 → 443 [PSH, ACK] Seq=905 Ack=13021 Win=9284 Len=153
