  441   7.608834  172.30.1.22 → 23.75.212.23 TCP 54 57263 → 443 [ACK] Seq=3463 Ack=151934 Win=9284 Len=0
  442   7.609240 23.75.212.23 → 172.30.1.22  TCP 1514 443 → 57263 [PSH, ACK] Seq=151934 Ack=3463 Win=501 Len=1460 [TCP segment of a reassembled PDU]
  443   7.611840 23.75.212.23 → 172.30.1.22  TCP 1514 443 → 57263 [ACK] Seq=153394 Ack=3463 Win=501 Len=1460 [TCP segment of a reassembled PDU]
  444   7.611840 23.75.212.23 → 172.30.1.22  TCP 1514 443 → 57263 [ACK] Seq=154854 Ack=3463 Win=501 Len=1460 [TCP segment of a reassembled PDU]
  445   7.611840 23.75.212.23 → 172.30.1.22  TCP 1514 443 → 57263 [PSH, ACK] Seq=156314 Ack=3463 Win=501 Len=1460 [TCP segment of a reassembled PDU]
  446   7.611840 23.75.212.23 → 172.30.1.22  TCP 1514 443 → 57263 [ACK] Seq=157774 Ack=3463 Win=501 Len=1460 [TCP segment of a reassembled PDU]
  447   7.611840 23.75.212.23 → 172.30.1.22  TCP 1514 443 → 57263 [ACK] Seq=159234 Ack=3463 Win=501 Len=1460 [TCP segment of a reassembled PDU]
  448   7.611840 23.75.212.23 → 172.30.1.22  TLSv1.2 1291 Application Data
  449   7.611840 172.217.175.110 → 172.30.1.22  UDP 67 443 → 54027 Len=25
  450   7.612082  172.30.1.22 → 23.75.212.23 TCP 54 57263 → 443 [ACK] Seq=3463 Ack=161931 Win=9284 Len=0
  451   7.653723  172.30.1.22 → 142.251.42.194 UDP 1246 51742 → 443 Len=1204
  452   7.660865  172.30.1.22 → 23.75.212.23 TLSv1.2 206 Application Data
  453   7.684906 142.251.42.194 → 172.30.1.22  UDP 73 443 → 51742 Len=31
  454   7.693577  172.30.1.22 → 142.251.42.194 UDP 75 51742 → 443 Len=33
  455   7.893309  172.30.1.22 → 142.251.42.194 UDP 75 51742 → 443 Len=33
  456   7.904416 23.75.212.23 → 172.30.1.22  TCP 66 [TCP Dup ACK 362#1] 443 → 57263 [ACK] Seq=161931 Ack=3463 Win=501 Len=0 SLE=3315 SRE=3463
  457   7.943474 142.251.42.194 → 172.30.1.22  UDP 243 443 → 51742 Len=201
  458   7.943474 142.251.42.194 → 172.30.1.22  UDP 283 443 → 51742 Len=241
  459   7.944161  172.30.1.22 → 142.251.42.194 UDP 80 51742 → 443 Len=38
  460   7.952999  172.30.1.22 → 142.251.42.194 UDP 75 51742 → 443 Len=33
