  401   7.599292 23.75.212.23 → 172.30.1.22  TCP 1514 443 → 57263 [ACK] Seq=99374 Ack=3463 Win=501 Len=1460 [TCP segment of a reassembled PDU]
  402   7.599292 23.75.212.23 → 172.30.1.22  TCP 1514 443 → 57263 [PSH, ACK] Seq=100834 Ack=3463 Win=501 Len=1460 [TCP segment of a reassembled PDU]
  403   7.599292 23.75.212.23 → 172.30.1.22  TCP 1514 443 → 57263 [ACK] Seq=102294 Ack=3463 Win=501 Len=1460 [TCP segment of a reassembled PDU]
  404   7.599292 23.75.212.23 → 172.30.1.22  TCP 1514 443 → 57263 [ACK] Seq=103754 Ack=3463 Win=501 Len=1460 [TCP segment of a reassembled PDU]
  405   7.599292 23.75.212.23 → 172.30.1.22  TCP 1514 443 → 57263 [PSH, ACK] Seq=105214 Ack=3463 Win=501 Len=1460 [TCP segment of a reassembled PDU]
  406   7.599292 23.75.212.23 → 172.30.1.22  TCP 1514 443 → 57263 [ACK] Seq=106674 Ack=3463 Win=501 Len=1460 [TCP segment of a reassembled PDU]
  407   7.599292 23.75.212.23 → 172.30.1.22  TCP 1514 443 → 57263 [ACK] Seq=108134 Ack=3463 Win=501 Len=1460 [TCP segment of a reassembled PDU]
  408   7.599292 23.75.212.23 → 172.30.1.22  TCP 1514 443 → 57263 [PSH, ACK] Seq=109594 Ack=3463 Win=501 Len=1460 [TCP segment of a reassembled PDU]
  409   7.599292 23.75.212.23 → 172.30.1.22  TCP 1514 443 → 57263 [ACK] Seq=111054 Ack=3463 Win=501 Len=1460 [TCP segment of a reassembled PDU]
  410   7.599292 23.75.212.23 → 172.30.1.22  TCP 1514 443 → 57263 [ACK] Seq=112514 Ack=3463 Win=501 Len=1460 [TCP segment of a reassembled PDU]
  411   7.599596  172.30.1.22 → 23.75.212.23 TCP 54 57263 → 443 [ACK] Seq=3463 Ack=113974 Win=9284 Len=0
  412   7.601036 23.75.212.23 → 172.30.1.22  TCP 1514 443 → 57263 [PSH, ACK] Seq=113974 Ack=3463 Win=501 Len=1460 [TCP segment of a reassembled PDU]
  413   7.601036 23.75.212.23 → 172.30.1.22  TLSv1.2 1514 Application Data [TCP segment of a reassembled PDU]
  414   7.601196  172.30.1.22 → 23.75.212.23 TCP 54 57263 → 443 [ACK] Seq=3463 Ack=116894 Win=9284 Len=0
  415   7.605127 23.75.212.23 → 172.30.1.22  TCP 1514 443 → 57263 [ACK] Seq=116894 Ack=3463 Win=501 Len=1460 [TCP segment of a reassembled PDU]
  416   7.605127 23.75.212.23 → 172.30.1.22  TCP 1514 443 → 57263 [PSH, ACK] Seq=118354 Ack=3463 Win=501 Len=1460 [TCP segment of a reassembled PDU]
  417   7.605127 23.75.212.23 → 172.30.1.22  TCP 1514 443 → 57263 [ACK] Seq=119814 Ack=3463 Win=501 Len=1460 [TCP segment of a reassembled PDU]
  418   7.605127 23.75.212.23 → 172.30.1.22  TCP 1514 443 → 57263 [ACK] Seq=121274 Ack=3463 Win=501 Len=1460 [TCP segment of a reassembled PDU]
  419   7.605127 23.75.212.23 → 172.30.1.22  TLSv1.2 1514 Application Data [TCP segment of a reassembled PDU]
  420   7.605127 23.75.212.23 → 172.30.1.22  TCP 1514 443 → 57263 [ACK] Seq=124194 Ack=3463 Win=501 Len=1460 [TCP segment of a reassembled PDU]
