  621   9.920482   35.213.5.5 → 172.30.1.22  TCP 54 443 → 57187 [ACK] Seq=33 Ack=2 Win=501 Len=0
  622   9.926433 18.246.31.133 → 172.30.1.22  TCP 54 443 → 56966 [ACK] Seq=1 Ack=68 Win=68 Len=0
  623   9.926433 18.246.31.133 → 172.30.1.22  TCP 54 443 → 56966 [ACK] Seq=1 Ack=107 Win=68 Len=0
  624   9.927687 18.246.31.133 → 172.30.1.22  TLSv1.2 93 Application Data
  625   9.929440 18.246.31.133 → 172.30.1.22  TLSv1.2 175 Application Data
  626   9.929599  172.30.1.22 → 18.246.31.133 TCP 54 56966 → 443 [ACK] Seq=107 Ack=161 Win=508 Len=0
  627   9.933936 172.217.161.66 → 172.30.1.22  UDP 68 443 → 60054 Len=26
  628   9.946216  172.30.1.22 → 18.246.31.133 TLSv1.2 121 Application Data
  629   9.960306 35.184.35.160 → 172.30.1.22  TCP 66 443 → 57285 [SYN, ACK] Seq=0 Ack=1 Win=42600 Len=0 MSS=1420 SACK_PERM=1 WS=128
  630   9.960489  172.30.1.22 → 35.184.35.160 TCP 54 57285 → 443 [ACK] Seq=1 Ack=1 Win=131840 Len=0
  631   9.962001 35.184.35.160 → 172.30.1.22  TCP 66 443 → 57286 [SYN, ACK] Seq=0 Ack=1 Win=42600 Len=0 MSS=1420 SACK_PERM=1 WS=128
  632   9.962193  172.30.1.22 → 35.184.35.160 TCP 54 57286 → 443 [ACK] Seq=1 Ack=1 Win=131840 Len=0
  633   9.965230  172.30.1.22 → 35.184.35.160 TLSv1 571 Client Hello
  634   9.966606  172.30.1.22 → 35.184.35.160 TLSv1 571 Client Hello
  635   9.968638 74.125.203.188 → 172.30.1.22  TCP 66 5228 → 54446 [ACK] Seq=1 Ack=2 Win=265 Len=0 SLE=1 SRE=2
  636   9.980305 144.217.66.206 → 172.30.1.22  TCP 54 443 → 57204 [ACK] Seq=33 Ack=2 Win=237 Len=0
  637  10.078988 20.195.65.207 → 172.30.1.22  TLSv1.2 88 Application Data
  638  10.096879 18.246.31.133 → 172.30.1.22  TLSv1.2 149 Application Data
  639  10.128787  172.30.1.22 → 20.195.65.207 TCP 54 57138 → 443 [ACK] Seq=1 Ack=35 Win=516 Len=0
  640  10.128888 35.184.35.160 → 172.30.1.22  TCP 54 443 → 57285 [ACK] Seq=1 Ack=518 Win=42368 Len=0
