  761  11.401964  172.30.1.22 → 172.217.175.110 UDP 81 54027 → 443 Len=39
  762  11.411151  172.30.1.22 → 172.217.175.110 UDP 75 54027 → 443 Len=33
  763  11.442341 172.217.175.110 → 172.30.1.22  UDP 67 443 → 54027 Len=25
  764  11.456870  172.30.1.22 → 172.217.161.66 UDP 1292 60054 → 443 Len=1250
  765  11.457154  172.30.1.22 → 172.217.161.66 UDP 156 60054 → 443 Len=114
  766  11.489015 172.217.161.66 → 172.30.1.22  UDP 68 443 → 60054 Len=26
  767  11.489015 172.217.161.66 → 172.30.1.22  UDP 68 443 → 60054 Len=26
  768  11.497326  172.30.1.22 → 172.217.161.66 UDP 75 60054 → 443 Len=33
  769  11.512015  208.91.0.89 → 172.30.1.22  TCP 54 443 → 57289 [ACK] Seq=4457 Ack=915 Win=4994 Len=0
  770  11.512712  208.91.0.89 → 172.30.1.22  TCP 54 443 → 57289 [ACK] Seq=4457 Ack=3658 Win=7737 Len=0
  771  11.520045  208.91.0.89 → 172.30.1.22  TLSv1.2 465 Application Data
  772  11.520879  172.30.1.22 → 208.91.0.89  TLSv1.2 85 Encrypted Alert
  773  11.523651  172.30.1.22 → 208.91.0.89  TCP 54 57289 → 443 [FIN, ACK] Seq=3689 Ack=4868 Win=64493 Len=0
  774  11.698129  172.30.1.22 → 172.217.161.66 UDP 75 60054 → 443 Len=33
  775  11.700766  208.91.0.89 → 172.30.1.22  TCP 54 443 → 57289 [ACK] Seq=4868 Ack=3689 Win=7768 Len=0
  776  11.700766  208.91.0.89 → 172.30.1.22  TCP 54 443 → 57289 [FIN, ACK] Seq=4868 Ack=3689 Win=7768 Len=0
  777  11.700936  172.30.1.22 → 208.91.0.89  TCP 54 57289 → 443 [ACK] Seq=3690 Ack=4869 Win=64493 Len=0
  778  11.701217  208.91.0.89 → 172.30.1.22  TCP 54 443 → 57289 [ACK] Seq=4869 Ack=3690 Win=7768 Len=0
  779  11.711540 172.217.161.66 → 172.30.1.22  UDP 245 443 → 60054 Len=203
  780  11.711540 172.217.161.66 → 172.30.1.22  UDP 98 443 → 60054 Len=56
