   61   2.295022 23.75.212.23 → 172.30.1.22  TCP 66 [TCP Dup ACK 54#1] 443 → 57263 [ACK] Seq=13021 Ack=905 Win=501 Len=0 SLE=756 SRE=905
   62   2.295022 23.75.212.23 → 172.30.1.22  TCP 60 443 → 57263 [ACK] Seq=13021 Ack=1058 Win=501 Len=0
   63   2.295022 23.75.212.23 → 172.30.1.22  TCP 1514 [TCP segment of a reassembled PDU]
   64   2.295264 23.75.212.23 → 172.30.1.22  TLSv1.2 1239 Application Data
   65   2.295355  172.30.1.22 → 23.75.212.23 TCP 54 57263 → 443 [ACK] Seq=1058 Ack=15666 Win=9284 Len=0
   66   2.313543  172.30.1.22 → 23.75.212.23 TLSv1.2 206 Application Data
   67   2.623649  172.30.1.22 → 23.75.212.23 TCP 206 [TCP Retransmission] 57263 → 443 [PSH, ACK] Seq=1058 Ack=15666 Win=9284 Len=152
   68   2.627256 23.75.212.23 → 172.30.1.22  TCP 66 [TCP Dup ACK 62#1] 443 → 57263 [ACK] Seq=15666 Ack=1058 Win=501 Len=0 SLE=905 SRE=1058
   69   2.627256 23.75.212.23 → 172.30.1.22  TCP 60 443 → 57263 [ACK] Seq=15666 Ack=1210 Win=501 Len=0
   70   2.627256 23.75.212.23 → 172.30.1.22  TCP 1514 [TCP segment of a reassembled PDU]
   71   2.627662 23.75.212.23 → 172.30.1.22  TLSv1.2 1375 Application Data
   72   2.627750  172.30.1.22 → 23.75.212.23 TCP 54 57263 → 443 [ACK] Seq=1210 Ack=18447 Win=9284 Len=0
   73   2.648655  172.30.1.22 → 23.75.212.23 TLSv1.2 207 Application Data
   74   2.779676  172.30.1.22 → 172.217.175.110 UDP 486 54027 → 443 Len=444
   75   2.812708 172.217.175.110 → 172.30.1.22  UDP 106 443 → 54027 Len=64
   76   2.812708 172.217.175.110 → 172.30.1.22  UDP 101 443 → 54027 Len=59
   77   2.813290  172.30.1.22 → 172.217.175.110 UDP 81 54027 → 443 Len=39
   78   2.822172  172.30.1.22 → 172.217.175.110 UDP 75 54027 → 443 Len=33
   79   2.843497  172.30.1.22 → 172.217.161.66 UDP 1292 60054 → 443 Len=1250
   80   2.843709  172.30.1.22 → 172.217.161.66 UDP 157 60054 → 443 Len=115
