  601   9.790928  172.30.1.22 → 107.178.244.193 TCP 54 57196 → 443 [FIN, ACK] Seq=1 Ack=1 Win=510 Len=0
  602   9.791149  172.30.1.22 → 35.213.12.39 TCP 54 57198 → 443 [FIN, ACK] Seq=1 Ack=33 Win=515 Len=0
  603   9.791264  172.30.1.22 → 35.213.12.39 TCP 54 57198 → 443 [RST, ACK] Seq=2 Ack=33 Win=0 Len=0
  604   9.792614  172.30.1.22 → 168.126.63.1 DNS 77 Standard query 0x67cd A esp.aptrinsic.com
  605   9.795386 168.126.63.1 → 172.30.1.22  DNS 233 Standard query response 0x67cd A esp.aptrinsic.com A 35.184.35.160 NS ns33.domaincontrol.com NS ns34.domaincontrol.com A 97.74.106.17 A 173.201.74.17 AAAA 2603:5:21a1::11 AAAA 2603:5:22a1::11
  606   9.796574 107.178.244.193 → 172.30.1.22  TCP 54 443 → 57196 [FIN, ACK] Seq=1 Ack=2 Win=261 Len=0
  607   9.796690  172.30.1.22 → 107.178.244.193 TCP 54 57196 → 443 [ACK] Seq=2 Ack=2 Win=510 Len=0
  608   9.796714  172.30.1.22 → 35.184.35.160 TCP 66 57285 → 443 [SYN] Seq=0 Win=64240 Len=0 MSS=1460 WS=256 SACK_PERM=1
  609   9.797232  172.30.1.22 → 35.184.35.160 TCP 66 57286 → 443 [SYN] Seq=0 Win=64240 Len=0 MSS=1460 WS=256 SACK_PERM=1
  610   9.797385 35.190.60.146 → 172.30.1.22  TCP 54 443 → 57200 [FIN, ACK] Seq=1 Ack=2 Win=261 Len=0
  611   9.797490  172.30.1.22 → 35.190.60.146 TCP 54 57200 → 443 [ACK] Seq=2 Ack=2 Win=510 Len=0
  612   9.820887 35.213.12.39 → 172.30.1.22  TCP 54 443 → 57189 [ACK] Seq=33 Ack=2 Win=501 Len=0
  613   9.820887 35.213.120.246 → 172.30.1.22  TCP 54 443 → 57188 [ACK] Seq=33 Ack=2 Win=501 Len=0
  614   9.822381 35.213.12.39 → 172.30.1.22  TCP 54 443 → 57198 [ACK] Seq=33 Ack=2 Win=501 Len=0
  615   9.823114 142.251.42.166 → 172.30.1.22  TCP 54 443 → 57182 [FIN, ACK] Seq=1 Ack=2 Win=262 Len=0
  616   9.823240  172.30.1.22 → 142.251.42.166 TCP 54 57182 → 443 [ACK] Seq=2 Ack=2 Win=508 Len=0
  617   9.879401   35.213.5.5 → 172.30.1.22  TCP 54 443 → 57186 [ACK] Seq=33 Ack=2 Win=501 Len=0
  618   9.893897  172.30.1.22 → 172.217.161.66 UDP 75 60054 → 443 Len=33
  619   9.909727  172.30.1.22 → 74.125.203.188 TCP 55 54446 → 5228 [ACK] Seq=1 Ack=1 Win=511 Len=1
  620   9.916446 209.191.163.210 → 172.30.1.22  TCP 54 443 → 57280 [ACK] Seq=26 Ack=2 Win=19 Len=0
