    1   0.000000  172.30.1.22 → 23.75.212.23 TLSv1.2 207 Application Data
    2   0.255465  172.30.1.22 → 13.113.117.76 TCP 55 [TCP segment of a reassembled PDU]
    3   0.294160 23.75.212.23 → 172.30.1.22  TCP 66 443 → 57263 [ACK] Seq=1 Ack=1 Win=501 Len=0 SLE=4294967148 SRE=1
    4   0.297559 13.113.117.76 → 172.30.1.22  TCP 66 443 → 57211 [ACK] Seq=1 Ack=2 Win=203 Len=0 SLE=1 SRE=2
    5   0.306074 23.75.212.23 → 172.30.1.22  TCP 60 443 → 57263 [ACK] Seq=1 Ack=154 Win=501 Len=0
    6   0.307373 23.75.212.23 → 172.30.1.22  TCP 1514 [TCP segment of a reassembled PDU]
    7   0.307373 23.75.212.23 → 172.30.1.22  TLSv1.2 1251 Application Data
    8   0.307610  172.30.1.22 → 23.75.212.23 TCP 54 57263 → 443 [ACK] Seq=154 Ack=2658 Win=9284 Len=0
    9   0.325482  172.30.1.22 → 23.75.212.23 TLSv1.2 203 Application Data
   10   0.469519 211.115.106.201 → 172.30.1.22  TCP 54 80 → 57282 [FIN, ACK] Seq=1 Ack=1 Win=30 Len=0
   11   0.469519 211.115.106.201 → 172.30.1.22  TCP 54 80 → 57283 [FIN, ACK] Seq=1 Ack=1 Win=30 Len=0
   12   0.469636  172.30.1.22 → 211.115.106.201 TCP 54 57282 → 80 [ACK] Seq=1 Ack=2 Win=511 Len=0
   13   0.469737  172.30.1.22 → 211.115.106.201 TCP 54 57283 → 80 [ACK] Seq=1 Ack=2 Win=511 Len=0
   14   0.632093  172.30.1.22 → 23.75.212.23 TCP 203 [TCP Retransmission] 57263 → 443 [PSH, ACK] Seq=154 Ack=2658 Win=9284 Len=149
   15   0.634989 23.75.212.23 → 172.30.1.22  TCP 60 443 → 57263 [ACK] Seq=2658 Ack=303 Win=501 Len=0
   16   0.634989 23.75.212.23 → 172.30.1.22  TCP 1514 [TCP segment of a reassembled PDU]
   17   0.634989 23.75.212.23 → 172.30.1.22  TLSv1.2 309 Application Data
   18   0.635150  172.30.1.22 → 23.75.212.23 TCP 54 57263 → 443 [ACK] Seq=303 Ack=4373 Win=9284 Len=0
   19   0.646873  172.30.1.22 → 23.75.212.23 TLSv1.2 207 Application Data
   20   0.912339  172.30.1.22 → 18.141.106.53 TCP 55 [TCP segment of a reassembled PDU]
   21   0.940185 23.75.212.23 → 172.30.1.22  TCP 66 [TCP Dup ACK 15#1] 443 → 57263 [ACK] Seq=4373 Ack=303 Win=501 Len=0 SLE=154 SRE=303
   22   0.953038 23.75.212.23 → 172.30.1.22  TCP 60 443 → 57263 [ACK] Seq=4373 Ack=456 Win=501 Len=0
   23   0.953776 23.75.212.23 → 172.30.1.22  TCP 1514 [TCP segment of a reassembled PDU]
   24   0.954057 23.75.212.23 → 172.30.1.22  TLSv1.2 1233 Application Data
   25   0.954252  172.30.1.22 → 23.75.212.23 TCP 54 57263 → 443 [ACK] Seq=456 Ack=7012 Win=9284 Len=0
   26   0.983208  172.30.1.22 → 23.75.212.23 TLSv1.2 206 Application Data
   27   1.021179 18.141.106.53 → 172.30.1.22  TCP 66 443 → 57227 [ACK] Seq=1 Ack=2 Win=133 Len=0 SLE=1 SRE=2
   28   1.067451 104.75.25.252 → 172.30.1.22  TLSv1.2 78 Application Data
   29   1.067451 104.75.25.252 → 172.30.1.22  TCP 54 443 → 57249 [FIN, ACK] Seq=25 Ack=1 Win=501 Len=0
   30   1.067677  172.30.1.22 → 104.75.25.252 TCP 54 57249 → 443 [ACK] Seq=1 Ack=26 Win=508 Len=0
   31   1.068104  172.30.1.22 → 104.75.25.252 TCP 54 57249 → 443 [FIN, ACK] Seq=1 Ack=26 Win=508 Len=0
   32   1.288196  172.30.1.22 → 23.75.212.23 TCP 206 [TCP Retransmission] 57263 → 443 [PSH, ACK] Seq=456 Ack=7012 Win=9284 Len=152
   33   1.291842 23.75.212.23 → 172.30.1.22  TCP 60 443 → 57263 [ACK] Seq=7012 Ack=608 Win=501 Len=0
   34   1.291842 23.75.212.23 → 172.30.1.22  TCP 1514 [TCP segment of a reassembled PDU]
   35   1.293216 23.75.212.23 → 172.30.1.22  TLSv1.2 1363 Application Data
   36   1.293373  172.30.1.22 → 23.75.212.23 TCP 54 57263 → 443 [ACK] Seq=608 Ack=9781 Win=9284 Len=0
   37   1.336591  172.30.1.22 → 23.75.212.23 TLSv1.2 202 Application Data
   38   1.381924  172.30.1.22 → 104.75.25.252 TCP 54 [TCP Retransmission] 57249 → 443 [FIN, ACK] Seq=1 Ack=26 Win=508 Len=0
   39   1.388358 173.223.96.137 → 172.30.1.22  TLSv1.2 85 Encrypted Alert
   40   1.388530 173.223.96.137 → 172.30.1.22  TCP 54 443 → 57250 [FIN, ACK] Seq=32 Ack=1 Win=501 Len=0
   41   1.388530 104.75.25.252 → 172.30.1.22  TCP 54 443 → 57249 [ACK] Seq=26 Ack=2 Win=501 Len=0
   42   1.388658  172.30.1.22 → 173.223.96.137 TCP 54 57250 → 443 [ACK] Seq=1 Ack=33 Win=513 Len=0
   43   1.388700  172.30.1.22 → 173.223.96.137 TCP 54 57250 → 443 [FIN, ACK] Seq=1 Ack=33 Win=513 Len=0
   44   1.647107  172.30.1.22 → 23.75.212.23 TCP 202 [TCP Retransmission] 57263 → 443 [PSH, ACK] Seq=608 Ack=9781 Win=9284 Len=148
   45   1.650297 23.75.212.23 → 172.30.1.22  TCP 66 [TCP Dup ACK 33#1] 443 → 57263 [ACK] Seq=9781 Ack=608 Win=501 Len=0 SLE=456 SRE=608
   46   1.650297 23.75.212.23 → 172.30.1.22  TCP 60 443 → 57263 [ACK] Seq=9781 Ack=756 Win=501 Len=0
   47   1.650297 23.75.212.23 → 172.30.1.22  TLSv1.2 1403 Application Data
   48   1.662302  172.30.1.22 → 13.225.121.92 TCP 55 [TCP segment of a reassembled PDU]
   49   1.665778  172.30.1.22 → 23.75.212.23 TLSv1.2 203 Application Data
   50   1.669144 13.225.121.92 → 172.30.1.22  TCP 66 443 → 57229 [ACK] Seq=1 Ack=2 Win=133 Len=0 SLE=1 SRE=2
   51   1.692443  172.30.1.22 → 173.223.96.137 TCP 54 [TCP Retransmission] 57250 → 443 [FIN, ACK] Seq=1 Ack=33 Win=513 Len=0
   52   1.903107 173.223.96.137 → 172.30.1.22  TCP 54 443 → 57250 [ACK] Seq=33 Ack=2 Win=501 Len=0
   53   1.954291 23.75.212.23 → 172.30.1.22  TCP 66 [TCP Dup ACK 46#1] 443 → 57263 [ACK] Seq=11130 Ack=756 Win=501 Len=0 SLE=608 SRE=756
   54   1.971202 23.75.212.23 → 172.30.1.22  TCP 60 443 → 57263 [ACK] Seq=11130 Ack=905 Win=501 Len=0
   55   1.971243  172.30.1.22 → 23.75.212.23 TCP 203 [TCP Spurious Retransmission] 57263 → 443 [PSH, ACK] Seq=756 Ack=11130 Win=9279 Len=149
   56   1.972937 23.75.212.23 → 172.30.1.22  TCP 1514 [TCP segment of a reassembled PDU]
   57   1.972937 23.75.212.23 → 172.30.1.22  TLSv1.2 485 Application Data
   58   1.973077  172.30.1.22 → 23.75.212.23 TCP 54 57263 → 443 [ACK] Seq=905 Ack=13021 Win=9284 Len=0
   59   1.986845  172.30.1.22 → 23.75.212.23 TLSv1.2 207 Application Data
   60   2.291483  172.30.1.22 → 23.75.212.23 TCP 207 [TCP Retransmission] 57263 → 443 [PSH, ACK] Seq=905 Ack=13021 Win=9284 Len=153
   61   2.295022 23.75.212.23 → 172.30.1.22  TCP 66 [TCP Dup ACK 54#1] 443 → 57263 [ACK] Seq=13021 Ack=905 Win=501 Len=0 SLE=756 SRE=905
   62   2.295022 23.75.212.23 → 172.30.1.22  TCP 60 443 → 57263 [ACK] Seq=13021 Ack=1058 Win=501 Len=0
   63   2.295022 23.75.212.23 → 172.30.1.22  TCP 1514 [TCP segment of a reassembled PDU]
   64   2.295264 23.75.212.23 → 172.30.1.22  TLSv1.2 1239 Application Data
   65   2.295355  172.30.1.22 → 23.75.212.23 TCP 54 57263 → 443 [ACK] Seq=1058 Ack=15666 Win=9284 Len=0
   66   2.313543  172.30.1.22 → 23.75.212.23 TLSv1.2 206 Application Data
   67   2.623649  172.30.1.22 → 23.75.212.23 TCP 206 [TCP Retransmission] 57263 → 443 [PSH, ACK] Seq=1058 Ack=15666 Win=9284 Len=152
   68   2.627256 23.75.212.23 → 172.30.1.22  TCP 66 [TCP Dup ACK 62#1] 443 → 57263 [ACK] Seq=15666 Ack=1058 Win=501 Len=0 SLE=905 SRE=1058
   69   2.627256 23.75.212.23 → 172.30.1.22  TCP 60 443 → 57263 [ACK] Seq=15666 Ack=1210 Win=501 Len=0
   70   2.627256 23.75.212.23 → 172.30.1.22  TCP 1514 [TCP segment of a reassembled PDU]
   71   2.627662 23.75.212.23 → 172.30.1.22  TLSv1.2 1375 Application Data
   72   2.627750  172.30.1.22 → 23.75.212.23 TCP 54 57263 → 443 [ACK] Seq=1210 Ack=18447 Win=9284 Len=0
   73   2.648655  172.30.1.22 → 23.75.212.23 TLSv1.2 207 Application Data
   74   2.779676  172.30.1.22 → 172.217.175.110 UDP 486 54027 → 443 Len=444
   75   2.812708 172.217.175.110 → 172.30.1.22  UDP 106 443 → 54027 Len=64
   76   2.812708 172.217.175.110 → 172.30.1.22  UDP 101 443 → 54027 Len=59
   77   2.813290  172.30.1.22 → 172.217.175.110 UDP 81 54027 → 443 Len=39
   78   2.822172  172.30.1.22 → 172.217.175.110 UDP 75 54027 → 443 Len=33
   79   2.843497  172.30.1.22 → 172.217.161.66 UDP 1292 60054 → 443 Len=1250
   80   2.843709  172.30.1.22 → 172.217.161.66 UDP 157 60054 → 443 Len=115
   81   2.853125 172.217.175.110 → 172.30.1.22  UDP 67 443 → 54027 Len=25
   82   2.874650 172.217.161.66 → 172.30.1.22  UDP 68 443 → 60054 Len=26
   83   2.874650 172.217.161.66 → 172.30.1.22  UDP 69 443 → 60054 Len=27
   84   2.883442  172.30.1.22 → 172.217.161.66 UDP 75 60054 → 443 Len=33
   85   2.931079 23.75.212.23 → 172.30.1.22  TCP 66 [TCP Dup ACK 69#1] 443 → 57263 [ACK] Seq=18447 Ack=1210 Win=501 Len=0 SLE=1058 SRE=1210
   86   2.955257 23.75.212.23 → 172.30.1.22  TCP 60 443 → 57263 [ACK] Seq=18447 Ack=1363 Win=501 Len=0
   87   2.957253 23.75.212.23 → 172.30.1.22  TCP 1514 [TCP segment of a reassembled PDU]
   88   2.958298 23.75.212.23 → 172.30.1.22  TLSv1.2 1219 Application Data
   89   2.958421  172.30.1.22 → 23.75.212.23 TCP 54 57263 → 443 [ACK] Seq=1363 Ack=21072 Win=9284 Len=0
   90   2.976859  172.30.1.22 → 23.75.212.23 TLSv1.2 203 Application Data
   91   3.082139  172.30.1.22 → 172.217.161.66 UDP 75 60054 → 443 Len=33
   92   3.103630 172.217.161.66 → 172.30.1.22  UDP 240 443 → 60054 Len=198
   93   3.103835 172.217.161.66 → 172.30.1.22  UDP 101 443 → 60054 Len=59
   94   3.104130  172.30.1.22 → 172.217.161.66 UDP 80 60054 → 443 Len=38
   95   3.113850  172.30.1.22 → 172.217.161.66 UDP 75 60054 → 443 Len=33
   96   3.122372 172.217.161.66 → 172.30.1.22  UDP 68 443 → 60054 Len=26
   97   3.142848 172.217.161.66 → 172.30.1.22  UDP 68 443 → 60054 Len=26
   98   3.179112  172.30.1.22 → 172.217.175.110 UDP 493 54027 → 443 Len=451
   99   3.210992 172.217.175.110 → 172.30.1.22  UDP 95 443 → 54027 Len=53
  100   3.210992 172.217.175.110 → 172.30.1.22  UDP 101 443 → 54027 Len=59
  101   3.211520  172.30.1.22 → 172.217.175.110 UDP 81 54027 → 443 Len=39
  102   3.220526  172.30.1.22 → 172.217.175.110 UDP 75 54027 → 443 Len=33
  103   3.242018 100.21.184.71 → 172.30.1.22  TLSv1.2 93 Application Data
  104   3.242408  172.30.1.22 → 100.21.184.71 TCP 54 57284 → 443 [FIN, ACK] Seq=1 Ack=40 Win=511 Len=0
  105   3.247837  172.30.1.22 → 172.217.161.66 UDP 1292 60054 → 443 Len=1250
  106   3.248054  172.30.1.22 → 172.217.161.66 UDP 138 60054 → 443 Len=96
  107   3.250688 172.217.175.110 → 172.30.1.22  UDP 67 443 → 54027 Len=25
  108   3.278699 172.217.161.66 → 172.30.1.22  UDP 68 443 → 60054 Len=26
  109   3.278699 172.217.161.66 → 172.30.1.22  UDP 69 443 → 60054 Len=27
  110   3.282445 23.75.212.23 → 172.30.1.22  TCP 60 443 → 57263 [ACK] Seq=21072 Ack=1512 Win=501 Len=0
  111   3.283617 23.75.212.23 → 172.30.1.22  TCP 1514 [TCP segment of a reassembled PDU]
  112   3.283617 23.75.212.23 → 172.30.1.22  TLSv1.2 481 Application Data
  113   3.283870  172.30.1.22 → 23.75.212.23 TCP 54 57263 → 443 [ACK] Seq=1512 Ack=22959 Win=9284 Len=0
  114   3.287609  172.30.1.22 → 172.217.161.66 UDP 75 60054 → 443 Len=33
  115   3.304920  172.30.1.22 → 23.75.212.23 TLSv1.2 207 Application Data
  116   3.388879 100.21.184.71 → 172.30.1.22  TLSv1.2 78 Application Data
  117   3.388879 100.21.184.71 → 172.30.1.22  TCP 54 443 → 57284 [FIN, ACK] Seq=64 Ack=2 Win=299 Len=0
  118   3.389034  172.30.1.22 → 100.21.184.71 TCP 54 57284 → 443 [RST, ACK] Seq=2 Ack=64 Win=0 Len=0
  119   3.488448  172.30.1.22 → 172.217.161.66 UDP 75 60054 → 443 Len=33
  120   3.494000 172.217.161.66 → 172.30.1.22  UDP 240 443 → 60054 Len=198
  121   3.494553  172.30.1.22 → 172.217.161.66 UDP 80 60054 → 443 Len=38
  122   3.495240 172.217.161.66 → 172.30.1.22  UDP 207 443 → 60054 Len=165
  123   3.504800  172.30.1.22 → 172.217.161.66 UDP 75 60054 → 443 Len=33
  124   3.526646 172.217.161.66 → 172.30.1.22  UDP 68 443 → 60054 Len=26
  125   3.530181  172.30.1.22 → 172.217.175.110 UDP 490 54027 → 443 Len=448
  126   3.563799 172.217.175.110 → 172.30.1.22  UDP 106 443 → 54027 Len=64
  127   3.564209 172.217.175.110 → 172.30.1.22  UDP 101 443 → 54027 Len=59
  128   3.564321  172.30.1.22 → 172.217.175.110 UDP 81 54027 → 443 Len=39
  129   3.568808 209.58.165.102 → 172.30.1.22  TCP 54 443 → 57262 [ACK] Seq=1 Ack=1 Win=83 Len=0
  130   3.568953  172.30.1.22 → 209.58.165.102 TCP 54 [TCP ACKed unseen segment] 57262 → 443 [ACK] Seq=1 Ack=2 Win=509 Len=0
  131   3.573576  172.30.1.22 → 172.217.175.110 UDP 75 54027 → 443 Len=33
  132   3.604757 172.217.175.110 → 172.30.1.22  UDP 67 443 → 54027 Len=25
  133   3.606023  172.30.1.22 → 142.251.42.194 UDP 1245 51742 → 443 Len=1203
  134   3.611443 23.75.212.23 → 172.30.1.22  TCP 60 443 → 57263 [ACK] Seq=22959 Ack=1665 Win=501 Len=0
  135   3.612736 23.75.212.23 → 172.30.1.22  TCP 1514 [TCP segment of a reassembled PDU]
  136   3.612736 23.75.212.23 → 172.30.1.22  TLSv1.2 1221 Application Data
  137   3.612960  172.30.1.22 → 23.75.212.23 TCP 54 57263 → 443 [ACK] Seq=1665 Ack=25586 Win=9284 Len=0
  138   3.630050  172.30.1.22 → 23.75.212.23 TLSv1.2 207 Application Data
  139   3.637666 142.251.42.194 → 172.30.1.22  UDP 72 443 → 51742 Len=30
  140   3.646769  172.30.1.22 → 142.251.42.194 UDP 75 51742 → 443 Len=33
  141   3.847453  172.30.1.22 → 142.251.42.194 UDP 75 51742 → 443 Len=33
  142   3.888410 142.251.42.194 → 172.30.1.22  UDP 68 443 → 51742 Len=26
  143   3.899448 142.251.42.194 → 172.30.1.22  UDP 235 443 → 51742 Len=193
  144   3.899448 142.251.42.194 → 172.30.1.22  UDP 162 443 → 51742 Len=120
  145   3.900066  172.30.1.22 → 142.251.42.194 UDP 79 51742 → 443 Len=37
  146   3.909650  172.30.1.22 → 142.251.42.194 UDP 75 51742 → 443 Len=33
  147   3.932151  172.30.1.22 → 172.217.175.110 UDP 495 54027 → 443 Len=453
  148   3.937564 23.75.212.23 → 172.30.1.22  TCP 1514 [TCP segment of a reassembled PDU]
  149   3.937564 23.75.212.23 → 172.30.1.22  TLSv1.2 1229 Application Data
  150   3.937786  172.30.1.22 → 23.75.212.23 TCP 54 57263 → 443 [ACK] Seq=1818 Ack=28221 Win=9284 Len=0
  151   3.938126 142.251.42.194 → 172.30.1.22  UDP 68 443 → 51742 Len=26
  152   3.964661 172.217.175.110 → 172.30.1.22  UDP 95 443 → 54027 Len=53
  153   3.964661 172.217.175.110 → 172.30.1.22  UDP 101 443 → 54027 Len=59
  154   3.965085  172.30.1.22 → 23.75.212.23 TLSv1.2 203 Application Data
  155   3.965489  172.30.1.22 → 172.217.175.110 UDP 81 54027 → 443 Len=39
  156   3.974400  172.30.1.22 → 172.217.175.110 UDP 75 54027 → 443 Len=33
  157   4.004671 172.217.175.110 → 172.30.1.22  UDP 67 443 → 54027 Len=25
  158   4.026319  172.30.1.22 → 142.251.42.194 UDP 1239 51742 → 443 Len=1197
  159   4.058111 142.251.42.194 → 172.30.1.22  UDP 72 443 → 51742 Len=30
  160   4.067783  172.30.1.22 → 142.251.42.194 UDP 75 51742 → 443 Len=33
  161   4.271900  172.30.1.22 → 23.75.212.23 TCP 203 [TCP Retransmission] 57263 → 443 [PSH, ACK] Seq=1818 Ack=28221 Win=9284 Len=149
  162   4.272296  172.30.1.22 → 142.251.42.194 UDP 75 51742 → 443 Len=33
  163   4.275726 142.251.42.194 → 172.30.1.22  UDP 206 443 → 51742 Len=164
  164   4.275726 142.251.42.194 → 172.30.1.22  UDP 158 443 → 51742 Len=116
  165   4.275726 23.75.212.23 → 172.30.1.22  TCP 1514 [TCP segment of a reassembled PDU]
  166   4.275726 23.75.212.23 → 172.30.1.22  TLSv1.2 477 Application Data
  167   4.276008  172.30.1.22 → 23.75.212.23 TCP 54 57263 → 443 [ACK] Seq=1967 Ack=30104 Win=9284 Len=0
  168   4.276534  172.30.1.22 → 142.251.42.194 UDP 79 51742 → 443 Len=37
  169   4.285214  172.30.1.22 → 142.251.42.194 UDP 75 51742 → 443 Len=33
  170   4.297130  172.30.1.22 → 23.75.212.23 TLSv1.2 207 Application Data
  171   4.312364 142.251.42.194 → 172.30.1.22  UDP 68 443 → 51742 Len=26
  172   4.317650  172.30.1.22 → 172.217.175.110 UDP 476 54027 → 443 Len=434
  173   4.349906 172.217.175.110 → 172.30.1.22  UDP 95 443 → 54027 Len=53
  174   4.349906 172.217.175.110 → 172.30.1.22  UDP 101 443 → 54027 Len=59
  175   4.350834  172.30.1.22 → 172.217.175.110 UDP 81 54027 → 443 Len=39
  176   4.360707  172.30.1.22 → 172.217.175.110 UDP 75 54027 → 443 Len=33
  177   4.390509 172.217.175.110 → 172.30.1.22  UDP 67 443 → 54027 Len=25
  178   4.407025  172.30.1.22 → 142.251.42.194 UDP 1228 51742 → 443 Len=1186
  179   4.438994 142.251.42.194 → 172.30.1.22  UDP 73 443 → 51742 Len=31
  180   4.447925  172.30.1.22 → 142.251.42.194 UDP 75 51742 → 443 Len=33
  181   4.602977  172.30.1.22 → 23.75.212.23 TCP 207 [TCP Retransmission] 57263 → 443 [PSH, ACK] Seq=1967 Ack=30104 Win=9284 Len=153
  182   4.607027 23.75.212.23 → 172.30.1.22  TCP 66 [TCP Dup ACK 165#1] 443 → 57263 [ACK] Seq=30104 Ack=1967 Win=501 Len=0 SLE=1818 SRE=1967
  183   4.607027 23.75.212.23 → 172.30.1.22  TCP 60 443 → 57263 [ACK] Seq=30104 Ack=2120 Win=501 Len=0
  184   4.607027 23.75.212.23 → 172.30.1.22  TCP 1514 [TCP segment of a reassembled PDU]
  185   4.607027 23.75.212.23 → 172.30.1.22  TLSv1.2 1373 Application Data
  186   4.607252  172.30.1.22 → 23.75.212.23 TCP 54 57263 → 443 [ACK] Seq=2120 Ack=32883 Win=9284 Len=0
  187   4.631607  172.30.1.22 → 23.75.212.23 TLSv1.2 202 Application Data
  188   4.649256  172.30.1.22 → 142.251.42.194 UDP 75 51742 → 443 Len=33
  189   4.687274 142.251.42.194 → 172.30.1.22  UDP 242 443 → 51742 Len=200
  190   4.687870 142.251.42.194 → 172.30.1.22  UDP 81 443 → 51742 Len=39
  191   4.687978  172.30.1.22 → 142.251.42.194 UDP 80 51742 → 443 Len=38
  192   4.697470  172.30.1.22 → 142.251.42.194 UDP 75 51742 → 443 Len=33
  193   4.726438 142.251.42.194 → 172.30.1.22  UDP 68 443 → 51742 Len=26
  194   4.737021  172.30.1.22 → 172.217.175.110 UDP 518 54027 → 443 Len=476
  195   4.769145 172.217.175.110 → 172.30.1.22  UDP 73 443 → 54027 Len=31
  196   4.778255  172.30.1.22 → 172.217.175.110 UDP 75 54027 → 443 Len=33
  197   4.801648 172.217.175.110 → 172.30.1.22  UDP 113 443 → 54027 Len=71
  198   4.802122 172.217.175.110 → 172.30.1.22  UDP 67 443 → 54027 Len=25
  199   4.802337  172.30.1.22 → 172.217.175.110 UDP 81 54027 → 443 Len=39
  200   4.812135  172.30.1.22 → 172.217.175.110 UDP 75 54027 → 443 Len=33
  201   4.842765 172.217.175.110 → 172.30.1.22  UDP 67 443 → 54027 Len=25
  202   4.868255  172.30.1.22 → 172.217.161.66 UDP 1292 60054 → 443 Len=1250
  203   4.868696  172.30.1.22 → 172.217.161.66 UDP 161 60054 → 443 Len=119
  204   4.901190 172.217.161.66 → 172.30.1.22  UDP 68 443 → 60054 Len=26
  205   4.901478 172.217.161.66 → 172.30.1.22  UDP 69 443 → 60054 Len=27
  206   4.910335 23.75.212.23 → 172.30.1.22  TCP 66 [TCP Dup ACK 183#1] 443 → 57263 [ACK] Seq=32883 Ack=2120 Win=501 Len=0 SLE=1967 SRE=2120
  207   4.910979  172.30.1.22 → 172.217.161.66 UDP 75 60054 → 443 Len=33
  208   4.937218 23.75.212.23 → 172.30.1.22  TCP 60 443 → 57263 [ACK] Seq=32883 Ack=2268 Win=501 Len=0
  209   4.938040 23.75.212.23 → 172.30.1.22  TCP 1514 [TCP segment of a reassembled PDU]
  210   4.938346 23.75.212.23 → 172.30.1.22  TLSv1.2 636 Application Data
  211   4.938503  172.30.1.22 → 23.75.212.23 TCP 54 57263 → 443 [ACK] Seq=2268 Ack=34925 Win=9284 Len=0
  212   4.956995  172.30.1.22 → 23.75.212.23 TLSv1.2 202 Application Data
  213   5.042703 172.217.161.66 → 172.30.1.22  UDP 241 443 → 60054 Len=199
  214   5.042703 172.217.161.66 → 172.30.1.22  UDP 166 443 → 60054 Len=124
  215   5.043472  172.30.1.22 → 172.217.161.66 UDP 80 60054 → 443 Len=38
  216   5.052803  172.30.1.22 → 172.217.161.66 UDP 75 60054 → 443 Len=33
  217   5.080618  172.30.1.22 → 172.217.175.110 UDP 481 54027 → 443 Len=439
  218   5.083486 172.217.161.66 → 172.30.1.22  UDP 68 443 → 60054 Len=26
  219   5.112470 172.217.175.110 → 172.30.1.22  UDP 106 443 → 54027 Len=64
  220   5.112470 172.217.175.110 → 172.30.1.22  UDP 101 443 → 54027 Len=59
  221   5.113037  172.30.1.22 → 172.217.175.110 UDP 81 54027 → 443 Len=39
  222   5.121580  172.30.1.22 → 172.217.175.110 UDP 75 54027 → 443 Len=33
  223   5.153146 172.217.175.110 → 172.30.1.22  UDP 67 443 → 54027 Len=25
  224   5.159517  172.30.1.22 → 172.217.161.66 UDP 1292 60054 → 443 Len=1250
  225   5.159959  172.30.1.22 → 172.217.161.66 UDP 138 60054 → 443 Len=96
  226   5.191126 172.217.161.66 → 172.30.1.22  UDP 73 443 → 60054 Len=31
  227   5.199696  172.30.1.22 → 172.217.161.66 UDP 75 60054 → 443 Len=33
  228   5.263332 23.75.212.23 → 172.30.1.22  TCP 60 443 → 57263 [ACK] Seq=34925 Ack=2416 Win=501 Len=0
  229   5.264748 23.75.212.23 → 172.30.1.22  TCP 1514 [TCP segment of a reassembled PDU]
  230   5.264748 23.75.212.23 → 172.30.1.22  TLSv1.2 480 Application Data
  231   5.264926  172.30.1.22 → 23.75.212.23 TCP 54 57263 → 443 [ACK] Seq=2416 Ack=36811 Win=9284 Len=0
  232   5.282931  172.30.1.22 → 23.75.212.23 TLSv1.2 203 Application Data
  233   5.395465  172.30.1.22 → 172.217.161.66 UDP 75 60054 → 443 Len=33
  234   5.397614 172.217.161.66 → 172.30.1.22  UDP 212 443 → 60054 Len=170
  235   5.397614 172.217.161.66 → 172.30.1.22  UDP 187 443 → 60054 Len=145
  236   5.398214  172.30.1.22 → 172.217.161.66 UDP 80 60054 → 443 Len=38
  237   5.408047  172.30.1.22 → 172.217.161.66 UDP 75 60054 → 443 Len=33
  238   5.431406  172.30.1.22 → 172.217.175.110 UDP 479 54027 → 443 Len=437
  239   5.435575 172.217.161.66 → 172.30.1.22  UDP 68 443 → 60054 Len=26
  240   5.463707 172.217.175.110 → 172.30.1.22  UDP 107 443 → 54027 Len=65
  241   5.463707 172.217.175.110 → 172.30.1.22  UDP 101 443 → 54027 Len=59
  242   5.464418  172.30.1.22 → 172.217.175.110 UDP 81 54027 → 443 Len=39
  243   5.472988  172.30.1.22 → 172.217.175.110 UDP 75 54027 → 443 Len=33
  244   5.504290 172.217.175.110 → 172.30.1.22  UDP 67 443 → 54027 Len=25
  245   5.525053  172.30.1.22 → 142.251.42.194 UDP 1245 51742 → 443 Len=1203
  246   5.557181 142.251.42.194 → 172.30.1.22  UDP 73 443 → 51742 Len=31
  247   5.565609  172.30.1.22 → 142.251.42.194 UDP 75 51742 → 443 Len=33
  248   5.590796 23.75.212.23 → 172.30.1.22  TCP 60 443 → 57263 [ACK] Seq=36811 Ack=2565 Win=501 Len=0
  249   5.592565 23.75.212.23 → 172.30.1.22  TCP 1514 [TCP segment of a reassembled PDU]
  250   5.592565 23.75.212.23 → 172.30.1.22  TLSv1.2 432 Application Data
  251   5.592777  172.30.1.22 → 23.75.212.23 TCP 54 57263 → 443 [ACK] Seq=2565 Ack=38649 Win=9284 Len=0
  252   5.610830  172.30.1.22 → 23.75.212.23 TLSv1.2 202 Application Data
  253   5.770317  172.30.1.22 → 142.251.42.194 UDP 75 51742 → 443 Len=33
  254   5.810958 142.251.42.194 → 172.30.1.22  UDP 68 443 → 51742 Len=26
  255   5.813664 142.251.42.194 → 172.30.1.22  UDP 235 443 → 51742 Len=193
  256   5.814095 142.251.42.194 → 172.30.1.22  UDP 203 443 → 51742 Len=161
  257   5.814315  172.30.1.22 → 142.251.42.194 UDP 80 51742 → 443 Len=38
  258   5.822596  172.30.1.22 → 142.251.42.194 UDP 75 51742 → 443 Len=33
  259   5.854219 142.251.42.194 → 172.30.1.22  UDP 68 443 → 51742 Len=26
  260   5.872327  172.30.1.22 → 172.217.175.110 UDP 477 54027 → 443 Len=435
  261   5.905047 172.217.175.110 → 172.30.1.22  UDP 96 443 → 54027 Len=54
  262   5.905047 172.217.175.110 → 172.30.1.22  UDP 101 443 → 54027 Len=59
  263   5.905915  172.30.1.22 → 172.217.175.110 UDP 81 54027 → 443 Len=39
  264   5.914619  172.30.1.22 → 172.217.175.110 UDP 75 54027 → 443 Len=33
  265   5.920803 23.75.212.23 → 172.30.1.22  TCP 1514 [TCP segment of a reassembled PDU]
  266   5.920803 23.75.212.23 → 172.30.1.22  TLSv1.2 661 Application Data
  267   5.921074  172.30.1.22 → 23.75.212.23 TCP 54 57263 → 443 [ACK] Seq=2713 Ack=40716 Win=9284 Len=0
  268   5.945802 172.217.175.110 → 172.30.1.22  UDP 67 443 → 54027 Len=25
  269   5.947409  172.30.1.22 → 23.75.212.23 TLSv1.2 203 Application Data
  270   6.025977  172.30.1.22 → 142.251.42.194 UDP 1240 51742 → 443 Len=1198
  271   6.043908 144.217.66.206 → 172.30.1.22  TLSv1.2 85 Encrypted Alert
  272   6.043908 144.217.66.206 → 172.30.1.22  TCP 54 443 → 57204 [FIN, ACK] Seq=32 Ack=1 Win=237 Len=0
  273   6.044076  172.30.1.22 → 144.217.66.206 TCP 54 57204 → 443 [ACK] Seq=1 Ack=33 Win=512 Len=0
  274   6.058127 142.251.42.194 → 172.30.1.22  UDP 73 443 → 51742 Len=31
  275   6.067135  172.30.1.22 → 142.251.42.194 UDP 75 51742 → 443 Len=33
  276   6.257355  172.30.1.22 → 23.75.212.23 TCP 203 [TCP Retransmission] 57263 → 443 [PSH, ACK] Seq=2713 Ack=40716 Win=9284 Len=149
  277   6.260355 23.75.212.23 → 172.30.1.22  TCP 1514 [TCP segment of a reassembled PDU]
  278   6.260601 23.75.212.23 → 172.30.1.22  TLSv1.2 485 Application Data
  279   6.260747  172.30.1.22 → 23.75.212.23 TCP 54 57263 → 443 [ACK] Seq=2862 Ack=42607 Win=9284 Len=0
  280   6.261077 142.251.42.194 → 172.30.1.22  UDP 206 443 → 51742 Len=164
  281   6.261077 142.251.42.194 → 172.30.1.22  UDP 128 443 → 51742 Len=86
  282   6.262096  172.30.1.22 → 142.251.42.194 UDP 80 51742 → 443 Len=38
  283   6.270805  172.30.1.22 → 142.251.42.194 UDP 75 51742 → 443 Len=33
  284   6.288912  172.30.1.22 → 23.75.212.23 TLSv1.2 207 Application Data
  285   6.300414 142.251.42.194 → 172.30.1.22  UDP 68 443 → 51742 Len=26
  286   6.344413  172.30.1.22 → 172.217.175.110 UDP 473 54027 → 443 Len=431
  287   6.377479 172.217.175.110 → 172.30.1.22  UDP 96 443 → 54027 Len=54
  288   6.377747 172.217.175.110 → 172.30.1.22  UDP 101 443 → 54027 Len=59
  289   6.378346  172.30.1.22 → 172.217.175.110 UDP 81 54027 → 443 Len=39
  290   6.386959  172.30.1.22 → 172.217.175.110 UDP 75 54027 → 443 Len=33
  291   6.418859 172.217.175.110 → 172.30.1.22  UDP 67 443 → 54027 Len=25
  292   6.421762 64.120.110.138 → 172.30.1.22  TLSv1.2 93 Application Data
  293   6.421985 64.120.110.138 → 172.30.1.22  TLSv1.2 78 Application Data
  294   6.422157  172.30.1.22 → 64.120.110.138 TCP 54 57279 → 443 [ACK] Seq=1 Ack=65 Win=509 Len=0
  295   6.422283  172.30.1.22 → 64.120.110.138 TCP 54 57279 → 443 [FIN, ACK] Seq=1 Ack=65 Win=509 Len=0
  296   6.422565  172.30.1.22 → 64.120.110.138 TCP 54 57279 → 443 [RST, ACK] Seq=2 Ack=65 Win=0 Len=0
  297   6.479053  172.30.1.22 → 142.251.42.194 UDP 1228 51742 → 443 Len=1186
  298   6.510341 142.251.42.194 → 172.30.1.22  UDP 73 443 → 51742 Len=31
  299   6.518527  172.30.1.22 → 142.251.42.194 UDP 75 51742 → 443 Len=33
  300   6.520377  172.30.1.22 → 13.94.47.61  TLSv1.2 180 Application Data
  301   6.564353 23.75.212.23 → 172.30.1.22  TCP 66 [TCP Dup ACK 277#1] 443 → 57263 [ACK] Seq=42607 Ack=2862 Win=501 Len=0 SLE=2713 SRE=2862
  302   6.594974 23.75.212.23 → 172.30.1.22  TCP 60 443 → 57263 [ACK] Seq=42607 Ack=3015 Win=501 Len=0
  303   6.595797 23.75.212.23 → 172.30.1.22  TCP 1514 [TCP segment of a reassembled PDU]
  304   6.596113 23.75.212.23 → 172.30.1.22  TLSv1.2 1237 Application Data
  305   6.596271  172.30.1.22 → 23.75.212.23 TCP 54 57263 → 443 [ACK] Seq=3015 Ack=45250 Win=9284 Len=0
  306   6.611038  13.94.47.61 → 172.30.1.22  TCP 54 9354 → 57150 [ACK] Seq=1 Ack=127 Win=2049 Len=0
  307   6.623215  172.30.1.22 → 23.75.212.23 TLSv1.2 206 Application Data
  308   6.626593 64.120.110.138 → 172.30.1.22  TCP 54 443 → 57279 [ACK] Seq=65 Ack=2 Win=501 Len=0
  309   6.713669 142.251.42.194 → 172.30.1.22  UDP 235 443 → 51742 Len=193
  310   6.713669 142.251.42.194 → 172.30.1.22  UDP 211 443 → 51742 Len=169
  311   6.714406  172.30.1.22 → 142.251.42.194 UDP 80 51742 → 443 Len=38
  312   6.723717  172.30.1.22 → 142.251.42.194 UDP 75 51742 → 443 Len=33
  313   6.753049 142.251.42.194 → 172.30.1.22  UDP 68 443 → 51742 Len=26
  314   6.756138  172.30.1.22 → 172.217.175.110 UDP 476 54027 → 443 Len=434
  315   6.788291 172.217.175.110 → 172.30.1.22  UDP 108 443 → 54027 Len=66
  316   6.788291 172.217.175.110 → 172.30.1.22  UDP 101 443 → 54027 Len=59
  317   6.789015  172.30.1.22 → 172.217.175.110 UDP 81 54027 → 443 Len=39
  318   6.798462  172.30.1.22 → 172.217.175.110 UDP 75 54027 → 443 Len=33
  319   6.828698 172.217.175.110 → 172.30.1.22  UDP 67 443 → 54027 Len=25
  320   6.844943  172.30.1.22 → 172.217.161.66 UDP 1292 60054 → 443 Len=1250
  321   6.845353  172.30.1.22 → 172.217.161.66 UDP 169 60054 → 443 Len=127
  322   6.876670 172.217.161.66 → 172.30.1.22  UDP 68 443 → 60054 Len=26
  323   6.876670 172.217.161.66 → 172.30.1.22  UDP 69 443 → 60054 Len=27
  324   6.886118  172.30.1.22 → 172.217.161.66 UDP 75 60054 → 443 Len=33
  325   6.929512 23.75.212.23 → 172.30.1.22  TCP 60 443 → 57263 [ACK] Seq=45250 Ack=3167 Win=501 Len=0
  326   6.930366 23.75.212.23 → 172.30.1.22  TCP 1514 [TCP segment of a reassembled PDU]
  327   6.930581 23.75.212.23 → 172.30.1.22  TLSv1.2 1036 Application Data
  328   6.930705  172.30.1.22 → 23.75.212.23 TCP 54 57263 → 443 [ACK] Seq=3167 Ack=47692 Win=9284 Len=0
  329   6.951690  172.30.1.22 → 23.75.212.23 TLSv1.2 202 Application Data
  330   7.083175  172.30.1.22 → 172.217.161.66 UDP 75 60054 → 443 Len=33
  331   7.124116 172.217.161.66 → 172.30.1.22  UDP 68 443 → 60054 Len=26
  332   7.132019 172.217.161.66 → 172.30.1.22  UDP 242 443 → 60054 Len=200
  333   7.132019 172.217.161.66 → 172.30.1.22  UDP 200 443 → 60054 Len=158
  334   7.132830  172.30.1.22 → 172.217.161.66 UDP 80 60054 → 443 Len=38
  335   7.141582  172.30.1.22 → 172.217.161.66 UDP 75 60054 → 443 Len=33
  336   7.169844  172.30.1.22 → 172.217.175.110 UDP 480 54027 → 443 Len=438
  337   7.172758 172.217.161.66 → 172.30.1.22  UDP 68 443 → 60054 Len=26
  338   7.202333 172.217.175.110 → 172.30.1.22  UDP 97 443 → 54027 Len=55
  339   7.202333 172.217.175.110 → 172.30.1.22  UDP 105 443 → 54027 Len=63
  340   7.203034  172.30.1.22 → 172.217.175.110 UDP 81 54027 → 443 Len=39
  341   7.212329  172.30.1.22 → 172.217.175.110 UDP 75 54027 → 443 Len=33
  342   7.242215 172.217.175.110 → 172.30.1.22  UDP 67 443 → 54027 Len=25
  343   7.257279  172.30.1.22 → 172.217.161.66 UDP 1292 60054 → 443 Len=1250
  344   7.257686  172.30.1.22 → 172.217.161.66 UDP 147 60054 → 443 Len=105
  345   7.257702 23.75.212.23 → 172.30.1.22  TCP 60 443 → 57263 [ACK] Seq=47692 Ack=3315 Win=501 Len=0
  346   7.258863 23.75.212.23 → 172.30.1.22  TCP 1514 [TCP segment of a reassembled PDU]
  347   7.258863 23.75.212.23 → 172.30.1.22  TLSv1.2 636 Application Data
  348   7.259046  172.30.1.22 → 23.75.212.23 TCP 54 57263 → 443 [ACK] Seq=3315 Ack=49734 Win=9284 Len=0
  349   7.273881  172.30.1.22 → 23.75.212.23 TLSv1.2 202 Application Data
  350   7.288931 172.217.161.66 → 172.30.1.22  UDP 68 443 → 60054 Len=26
  351   7.288931 172.217.161.66 → 172.30.1.22  UDP 69 443 → 60054 Len=27
  352   7.297187  172.30.1.22 → 172.217.161.66 UDP 75 60054 → 443 Len=33
  353   7.503948  172.30.1.22 → 172.217.161.66 UDP 75 60054 → 443 Len=33
  354   7.506422 172.217.161.66 → 172.30.1.22  UDP 291 443 → 60054 Len=249
  355   7.506970  172.30.1.22 → 172.217.161.66 UDP 80 60054 → 443 Len=38
  356   7.539542  172.30.1.22 → 172.217.175.110 UDP 479 54027 → 443 Len=437
  357   7.544003 172.217.161.66 → 172.30.1.22  UDP 68 443 → 60054 Len=26
  358   7.571336 172.217.175.110 → 172.30.1.22  UDP 109 443 → 54027 Len=67
  359   7.571336 172.217.175.110 → 172.30.1.22  UDP 101 443 → 54027 Len=59
  360   7.572046  172.30.1.22 → 172.217.175.110 UDP 81 54027 → 443 Len=39
  361   7.579681  172.30.1.22 → 23.75.212.23 TCP 202 [TCP Retransmission] 57263 → 443 [PSH, ACK] Seq=3315 Ack=49734 Win=9284 Len=148
  362   7.580538 23.75.212.23 → 172.30.1.22  TCP 1514 [TCP segment of a reassembled PDU]
  363   7.581588  172.30.1.22 → 172.217.175.110 UDP 75 54027 → 443 Len=33
  364   7.582871 23.75.212.23 → 172.30.1.22  TCP 1514 443 → 57263 [ACK] Seq=51194 Ack=3463 Win=501 Len=1460 [TCP segment of a reassembled PDU]
  365   7.582871 23.75.212.23 → 172.30.1.22  TCP 1514 443 → 57263 [PSH, ACK] Seq=52654 Ack=3463 Win=501 Len=1460 [TCP segment of a reassembled PDU]
  366   7.582871 23.75.212.23 → 172.30.1.22  TCP 1514 443 → 57263 [ACK] Seq=54114 Ack=3463 Win=501 Len=1460 [TCP segment of a reassembled PDU]
  367   7.582871 23.75.212.23 → 172.30.1.22  TCP 1514 443 → 57263 [ACK] Seq=55574 Ack=3463 Win=501 Len=1460 [TCP segment of a reassembled PDU]
  368   7.583093  172.30.1.22 → 23.75.212.23 TCP 54 57263 → 443 [ACK] Seq=3463 Ack=57034 Win=9284 Len=0
  369   7.586070 23.75.212.23 → 172.30.1.22  TCP 1514 443 → 57263 [PSH, ACK] Seq=57034 Ack=3463 Win=501 Len=1460 [TCP segment of a reassembled PDU]
  370   7.586232  172.30.1.22 → 23.75.212.23 TCP 54 57263 → 443 [ACK] Seq=3463 Ack=58494 Win=9284 Len=0
  371   7.593497 23.75.212.23 → 172.30.1.22  TCP 1514 443 → 57263 [ACK] Seq=58494 Ack=3463 Win=501 Len=1460 [TCP segment of a reassembled PDU]
  372   7.593497 23.75.212.23 → 172.30.1.22  TCP 1514 443 → 57263 [ACK] Seq=59954 Ack=3463 Win=501 Len=1460 [TCP segment of a reassembled PDU]
  373   7.593497 23.75.212.23 → 172.30.1.22  TCP 1514 443 → 57263 [PSH, ACK] Seq=61414 Ack=3463 Win=501 Len=1460 [TCP segment of a reassembled PDU]
  374   7.593497 23.75.212.23 → 172.30.1.22  TCP 1514 443 → 57263 [ACK] Seq=62874 Ack=3463 Win=501 Len=1460 [TCP segment of a reassembled PDU]
  375   7.593497 23.75.212.23 → 172.30.1.22  TCP 1514 443 → 57263 [ACK] Seq=64334 Ack=3463 Win=501 Len=1460 [TCP segment of a reassembled PDU]
  376   7.593497 23.75.212.23 → 172.30.1.22  TLSv1.2 1514 Application Data [TCP segment of a reassembled PDU]
  377   7.593497 23.75.212.23 → 172.30.1.22  TCP 1514 443 → 57263 [ACK] Seq=67254 Ack=3463 Win=501 Len=1460 [TCP segment of a reassembled PDU]
  378   7.593497 23.75.212.23 → 172.30.1.22  TCP 1514 443 → 57263 [ACK] Seq=68714 Ack=3463 Win=501 Len=1460 [TCP segment of a reassembled PDU]
  379   7.593497 23.75.212.23 → 172.30.1.22  TCP 1514 443 → 57263 [PSH, ACK] Seq=70174 Ack=3463 Win=501 Len=1460 [TCP segment of a reassembled PDU]
  380   7.593497 23.75.212.23 → 172.30.1.22  TCP 1514 443 → 57263 [ACK] Seq=71634 Ack=3463 Win=501 Len=1460 [TCP segment of a reassembled PDU]
  381   7.593497 23.75.212.23 → 172.30.1.22  TCP 1514 443 → 57263 [ACK] Seq=73094 Ack=3463 Win=501 Len=1460 [TCP segment of a reassembled PDU]
  382   7.593497 23.75.212.23 → 172.30.1.22  TLSv1.2 1514 Application Data [TCP segment of a reassembled PDU]
  383   7.593497 23.75.212.23 → 172.30.1.22  TCP 1514 443 → 57263 [ACK] Seq=76014 Ack=3463 Win=501 Len=1460 [TCP segment of a reassembled PDU]
  384   7.593497 23.75.212.23 → 172.30.1.22  TCP 1514 443 → 57263 [ACK] Seq=77474 Ack=3463 Win=501 Len=1460 [TCP segment of a reassembled PDU]
  385   7.593497 23.75.212.23 → 172.30.1.22  TCP 1514 443 → 57263 [PSH, ACK] Seq=78934 Ack=3463 Win=501 Len=1460 [TCP segment of a reassembled PDU]
  386   7.593497 23.75.212.23 → 172.30.1.22  TCP 1514 443 → 57263 [ACK] Seq=80394 Ack=3463 Win=501 Len=1460 [TCP segment of a reassembled PDU]
  387   7.593497 23.75.212.23 → 172.30.1.22  TCP 1514 443 → 57263 [ACK] Seq=81854 Ack=3463 Win=501 Len=1460 [TCP segment of a reassembled PDU]
  388   7.593497 23.75.212.23 → 172.30.1.22  TCP 1514 443 → 57263 [PSH, ACK] Seq=83314 Ack=3463 Win=501 Len=1460 [TCP segment of a reassembled PDU]
  389   7.593497 23.75.212.23 → 172.30.1.22  TCP 1514 443 → 57263 [ACK] Seq=84774 Ack=3463 Win=501 Len=1460 [TCP segment of a reassembled PDU]
  390   7.593497 23.75.212.23 → 172.30.1.22  TCP 1514 443 → 57263 [ACK] Seq=86234 Ack=3463 Win=501 Len=1460 [TCP segment of a reassembled PDU]
  391   7.593497 23.75.212.23 → 172.30.1.22  TCP 1514 443 → 57263 [PSH, ACK] Seq=87694 Ack=3463 Win=501 Len=1460 [TCP segment of a reassembled PDU]
  392   7.593497 23.75.212.23 → 172.30.1.22  TCP 1514 443 → 57263 [ACK] Seq=89154 Ack=3463 Win=501 Len=1460 [TCP segment of a reassembled PDU]
  393   7.593848  172.30.1.22 → 23.75.212.23 TCP 54 57263 → 443 [ACK] Seq=3463 Ack=90614 Win=9284 Len=0
  394   7.595263 23.75.212.23 → 172.30.1.22  TLSv1.2 1514 Application Data [TCP segment of a reassembled PDU]
  395   7.595263 23.75.212.23 → 172.30.1.22  TCP 1514 443 → 57263 [PSH, ACK] Seq=92074 Ack=3463 Win=501 Len=1460 [TCP segment of a reassembled PDU]
  396   7.595263 23.75.212.23 → 172.30.1.22  TCP 1514 443 → 57263 [ACK] Seq=93534 Ack=3463 Win=501 Len=1460 [TCP segment of a reassembled PDU]
  397   7.595263 23.75.212.23 → 172.30.1.22  TCP 1514 443 → 57263 [ACK] Seq=94994 Ack=3463 Win=501 Len=1460 [TCP segment of a reassembled PDU]
  398   7.595263 23.75.212.23 → 172.30.1.22  TCP 1514 443 → 57263 [PSH, ACK] Seq=96454 Ack=3463 Win=501 Len=1460 [TCP segment of a reassembled PDU]
  399   7.595458  172.30.1.22 → 23.75.212.23 TCP 54 57263 → 443 [ACK] Seq=3463 Ack=97914 Win=9284 Len=0
  400   7.599292 23.75.212.23 → 172.30.1.22  TLSv1.2 1514 Application Data [TCP segment of a reassembled PDU]
  401   7.599292 23.75.212.23 → 172.30.1.22  TCP 1514 443 → 57263 [ACK] Seq=99374 Ack=3463 Win=501 Len=1460 [TCP segment of a reassembled PDU]
  402   7.599292 23.75.212.23 → 172.30.1.22  TCP 1514 443 → 57263 [PSH, ACK] Seq=100834 Ack=3463 Win=501 Len=1460 [TCP segment of a reassembled PDU]
  403   7.599292 23.75.212.23 → 172.30.1.22  TCP 1514 443 → 57263 [ACK] Seq=102294 Ack=3463 Win=501 Len=1460 [TCP segment of a reassembled PDU]
  404   7.599292 23.75.212.23 → 172.30.1.22  TCP 1514 443 → 57263 [ACK] Seq=103754 Ack=3463 Win=501 Len=1460 [TCP segment of a reassembled PDU]
  405   7.599292 23.75.212.23 → 172.30.1.22  TCP 1514 443 → 57263 [PSH, ACK] Seq=105214 Ack=3463 Win=501 Len=1460 [TCP segment of a reassembled PDU]
  406   7.599292 23.75.212.23 → 172.30.1.22  TCP 1514 443 → 57263 [ACK] Seq=106674 Ack=3463 Win=501 Len=1460 [TCP segment of a reassembled PDU]
  407   7.599292 23.75.212.23 → 172.30.1.22  TCP 1514 443 → 57263 [ACK] Seq=108134 Ack=3463 Win=501 Len=1460 [TCP segment of a reassembled PDU]
  408   7.599292 23.75.212.23 → 172.30.1.22  TCP 1514 443 → 57263 [PSH, ACK] Seq=109594 Ack=3463 Win=501 Len=1460 [TCP segment of a reassembled PDU]
  409   7.599292 23.75.212.23 → 172.30.1.22  TCP 1514 443 → 57263 [ACK] Seq=111054 Ack=3463 Win=501 Len=1460 [TCP segment of a reassembled PDU]
  410   7.599292 23.75.212.23 → 172.30.1.22  TCP 1514 443 → 57263 [ACK] Seq=112514 Ack=3463 Win=501 Len=1460 [TCP segment of a reassembled PDU]
  411   7.599596  172.30.1.22 → 23.75.212.23 TCP 54 57263 → 443 [ACK] Seq=3463 Ack=113974 Win=9284 Len=0
  412   7.601036 23.75.212.23 → 172.30.1.22  TCP 1514 443 → 57263 [PSH, ACK] Seq=113974 Ack=3463 Win=501 Len=1460 [TCP segment of a reassembled PDU]
  413   7.601036 23.75.212.23 → 172.30.1.22  TLSv1.2 1514 Application Data [TCP segment of a reassembled PDU]
  414   7.601196  172.30.1.22 → 23.75.212.23 TCP 54 57263 → 443 [ACK] Seq=3463 Ack=116894 Win=9284 Len=0
  415   7.605127 23.75.212.23 → 172.30.1.22  TCP 1514 443 → 57263 [ACK] Seq=116894 Ack=3463 Win=501 Len=1460 [TCP segment of a reassembled PDU]
  416   7.605127 23.75.212.23 → 172.30.1.22  TCP 1514 443 → 57263 [PSH, ACK] Seq=118354 Ack=3463 Win=501 Len=1460 [TCP segment of a reassembled PDU]
  417   7.605127 23.75.212.23 → 172.30.1.22  TCP 1514 443 → 57263 [ACK] Seq=119814 Ack=3463 Win=501 Len=1460 [TCP segment of a reassembled PDU]
  418   7.605127 23.75.212.23 → 172.30.1.22  TCP 1514 443 → 57263 [ACK] Seq=121274 Ack=3463 Win=501 Len=1460 [TCP segment of a reassembled PDU]
  419   7.605127 23.75.212.23 → 172.30.1.22  TLSv1.2 1514 Application Data [TCP segment of a reassembled PDU]
  420   7.605127 23.75.212.23 → 172.30.1.22  TCP 1514 443 → 57263 [ACK] Seq=124194 Ack=3463 Win=501 Len=1460 [TCP segment of a reassembled PDU]
  421   7.605127 23.75.212.23 → 172.30.1.22  TCP 1514 443 → 57263 [ACK] Seq=125654 Ack=3463 Win=501 Len=1460 [TCP segment of a reassembled PDU]
  422   7.605127 23.75.212.23 → 172.30.1.22  TCP 1514 443 → 57263 [PSH, ACK] Seq=127114 Ack=3463 Win=501 Len=1460 [TCP segment of a reassembled PDU]
  423   7.605127 23.75.212.23 → 172.30.1.22  TCP 1514 443 → 57263 [ACK] Seq=128574 Ack=3463 Win=501 Len=1460 [TCP segment of a reassembled PDU]
  424   7.605127 23.75.212.23 → 172.30.1.22  TCP 1514 443 → 57263 [PSH, ACK] Seq=130034 Ack=3463 Win=501 Len=1460 [TCP segment of a reassembled PDU]
  425   7.605127 23.75.212.23 → 172.30.1.22  TCP 1514 443 → 57263 [ACK] Seq=131494 Ack=3463 Win=501 Len=1460 [TCP segment of a reassembled PDU]
  426   7.605127 23.75.212.23 → 172.30.1.22  TCP 1514 443 → 57263 [ACK] Seq=132954 Ack=3463 Win=501 Len=1460 [TCP segment of a reassembled PDU]
  427   7.605127 23.75.212.23 → 172.30.1.22  TCP 1514 443 → 57263 [PSH, ACK] Seq=134414 Ack=3463 Win=501 Len=1460 [TCP segment of a reassembled PDU]
  428   7.605351  172.30.1.22 → 23.75.212.23 TCP 54 57263 → 443 [ACK] Seq=3463 Ack=135874 Win=9284 Len=0
  429   7.606830 23.75.212.23 → 172.30.1.22  TCP 1514 443 → 57263 [ACK] Seq=135874 Ack=3463 Win=501 Len=1460 [TCP segment of a reassembled PDU]
  430   7.606830 23.75.212.23 → 172.30.1.22  TCP 1514 443 → 57263 [ACK] Seq=137334 Ack=3463 Win=501 Len=1460 [TCP segment of a reassembled PDU]
  431   7.606830 23.75.212.23 → 172.30.1.22  TCP 1514 443 → 57263 [PSH, ACK] Seq=138794 Ack=3463 Win=501 Len=1460 [TCP segment of a reassembled PDU]
  432   7.606830 23.75.212.23 → 172.30.1.22  TLSv1.2 1514 Application Data [TCP segment of a reassembled PDU]
